1887319,202203,1801-2400,ZZZ.Airport,US,,,,1000,,,,,Daylight,,,Tower ZZZ,Air Carrier,B737 Undifferentiated or Other Model,,2,Part 121,IFR,Passenger,FMS Or FMC; GPS; Localizer/Glideslope/ILS ILS XYL,Final Approach; Initial Approach,Direct,Class B ZZZ,,,,,,,,,,,,,,,,,,,,,,,,,,,,,,,,,,,,,,,,,,,,,,,,,,,,,,,,,,,,,,,Aircraft X,Flight Deck,Air Carrier,Captain; Pilot Not Flying,Flight Crew Multiengine; Flight Crew Air Transport Pilot (ATP); Flight Crew Instrument,,,Time Pressure; Workload; Situational Awareness; Communication Breakdown; Distraction,Party1 Flight Crew; Party2 Flight Crew,,1887319,Aircraft X,,,First Officer; Pilot Flying,Flight Crew Instrument; Flight Crew Multiengine; Flight Crew Air Transport Pilot (ATP),,,Distraction; Communication Breakdown; Workload; Time Pressure; Troubleshooting; Situational Awareness,Party1 Flight Crew; Party2 Flight Crew,,1887328,Deviation / Discrepancy - Procedural Published Material / Policy; Inflight Event / Encounter CFTT / CFIT; Inflight Event / Encounter Unstabilized Approach,,,Automation Aircraft Other Automation,In-flight,Flight Crew Became Reoriented; Flight Crew FLC complied w / Automation / Advisory,Human Factors,Human Factors,"We were flying a Visual Approach to Runway XXR at ZZZ. At about 1500 ft. MSL; Tower offered us Runway XXL; seemingly due to closeness of the aircraft in front of us. We were given 160 kts. until the marker; and had not configured to our final flaps (30). When we accepted Runway XXL; I 'went inside' and re-tuned to the Runway XXL Localizer. We made the 1000 ft. call; but had not fully configured. We got a 'Too Low; Flaps' alert and I selected flaps 30. I had 'tunnel vision'; focusing on the approach profile; which was normal; and didn't call for a go-around. We continued the approach and landing.Don't accept a runway change close in. We should have gone around when we got the alert. Aviate first; (complete configuring); then Navigate (I was distracted when I re-tuned and we really didn't need the new localizer to fly the visual); then Communicate (we both missed the Before Landing Checklist).",,"We were cleared Visual Approach XXR; 160 kts. to ZZZZZ. About 1500 ft.; Tower asked if we could accept XXL. The Captain said 'yes' and we both commented that a side-step runway change was very unusual at ZZZ. We were then cleared the Visual; cleared to land XXL. As Pilot Flying; I adjusted course for straight in XXL. I then remembered that the PAPI was NOTAM'd out on XXL so I requested the Captain tune in the LOC XXL so additional glide path information was available. He did so. As a result of the workload associated with the runway change; and the fact that we were assigned 160 kts. to ZZZZZ (delaying the timing of 30 flaps selection); we missed the Before Landing Checklist and the 1000 ft. call outs. We only had 15 degrees of flaps in and realized it when the 'Too Low Flaps' aural warning sounded. The Captain lowered the flap handle to the 30 detent; warning stopped; and we landed on XXL.In hindsight and after discussing the event; the Captain and I both agreed that we should have either continued the approach for XXR or when we received the 'Too Low Flaps' aural warning; we should have gone around. I let the pressures of completing the mission; complying with an ATC request and resulting increased workload distract me; and as a result missed a checklist that would have caught the 15 flap configuration. At no time did I feel we were operating in an unsafe manner but distraction was definitely a factor. In the future; I will either refuse the runway change and/or just go-around.",,"Air Carrier Pilots reported they were not configured for landing on final approach. They had been given a late runway change to an adjacent runway and in the rush to change the FMS/ILS; the Landing Checklist was not completed. The pilots received a flap warning; did not go around; reconfigured the flaps and landed.",
1887358,202203,0601-1200,EWR.Tower,NJ,,,,1700,,VMC,,,,,,Tower EWR,Air Carrier,Medium Transport; Low Wing; 2 Turbojet Eng,,2,Part 121,IFR,Passenger,,Final Approach,,Class B EWR,,,,,,,,,,,,,,,,,,,,,,,,,,,,,,,,,,,,,,,,,,,,,,,,,,,,,,,,,,,,,,,Aircraft X,Flight Deck,Air Carrier,Pilot Not Flying; Captain,Flight Crew Air Transport Pilot (ATP),Flight Crew Last 90 Days 69,,Situational Awareness,,,1887358,,,,,,,,,,,,Ground Event / Encounter Ground Equipment Issue; Inflight Event / Encounter CFTT / CFIT; Inflight Event / Encounter Unstabilized Approach,,,Person Air Traffic Control,In-flight,Air Traffic Control Issued Advisory / Alert; Flight Crew Became Reoriented,ATC Equipment / Nav Facility / Buildings; Human Factors,Human Factors,"We were flying the Stadium Visual Runway 29 approach with a speed restriction of 170 kts. to SLIMR. The approach was well-briefed and the automation was set up in LNAV VNAV Path; autopilot and auto throttle engaged with touchdown zone elevation set in the MCP altitude window immediately after GIMEE. Additionally; we had inserted COPKO on the legs page after SLIMR and before CHUMR. We'd planned on being in final landing configuration by SLIMR and we were able to have the gear down and the flaps to 15 but we held off the final flaps momentarily approaching SLIMR due to the ATC speed restriction and the lower flap limiting speeds of [this] aircraft. At this point; I became aware that the approach happens more quickly than I expected and that we had a manageable amount of excess energy. Passing SLIMR; we reduced airspeed but two unusual things happened. First; the Tower Controller advised us to slow to final approach airspeed and said 'Low Altitude Alert'. I'm still unsure if the low altitude alert was for us because it looked like we were high if anything. The other thing was our vertical guidance went away and the autopilot reverted to [a degraded mode]. I instructed my First Officer to turn off the autopilot. He did; and did a great job of hand flying from there. I got the flaps to final and the checklist complete. We descended to and captured a normal visual glide path by approximately 500 ft. AGL. The rest of the landing was uneventful.",,,,"Air carrier Captain reported receiving a low altitude alert from ATC on the Stadium Visual approach to EWR.",
1887585,202203,1201-1800,ZZZ.Tower,US,200,5,,200,,VMC,,,Daylight,,,Tower ZZZ,Air Carrier,B737-700,,,Part 121,IFR,Passenger,,Final Approach,Visual Approach,Class B ZZZ,,,,,,,,,,,,,,,,,,,,,,,,,,,,,,,,,,,,,,,,,,,,,,,,,,,,,,,,,,,,,,,Aircraft X,Flight Deck,Air Carrier,Pilot Flying; Flight Engineer / Second Officer; Captain,Flight Crew Instrument; Flight Crew Multiengine; Flight Crew Air Transport Pilot (ATP); Flight Crew Flight Instructor,Flight Crew Last 90 Days 240; Flight Crew Total 23000; Flight Crew Type 7500,,Situational Awareness,,,1887585,,,,,,,,,,,,Deviation - Altitude Overshoot; Deviation / Discrepancy - Procedural Published Material / Policy; Inflight Event / Encounter Unstabilized Approach; Inflight Event / Encounter CFTT / CFIT,,,Person Flight Crew,In-flight,Flight Crew Became Reoriented,Human Factors,Human Factors,"On short final inadvertently went below glideslopes and PAPI. Landing uneventful.",,,,"B737 pilot reported they inadvertently descended below the glideslope.",
1887677,202203,0601-1200,EISN.ARTCC,FO,,,,3000,,VMC,,,,,,Tower EINN,Air Carrier,Medium Large Transport; Low Wing; 2 Turbojet Eng,,2,Part 121,IFR,Passenger,,Final Approach,,,,,,,,,,,,,,,,,,,,,,,,,,ILS/VOR,,X,Malfunctioning,,,,,,,,,,,,,,,,,,,,,,,,,,,,,,,,,,,,Aircraft X,Flight Deck,Air Carrier,Captain; Pilot Flying,Flight Crew Air Transport Pilot (ATP),Flight Crew Last 90 Days 13; Flight Crew Type 1696,,Troubleshooting; Human-Machine Interface; Situational Awareness,,,1887677,Aircraft X,Flight Deck,Air Carrier,Pilot Not Flying; First Officer,Flight Crew Air Transport Pilot (ATP),Flight Crew Last 90 Days 87; Flight Crew Type 87,,Human-Machine Interface; Situational Awareness,,,1887350,Aircraft Equipment Problem Less Severe; Deviation - Altitude Crossing Restriction Not Met; Deviation / Discrepancy - Procedural Published Material / Policy; Ground Event / Encounter Ground Equipment Issue; Inflight Event / Encounter CFTT / CFIT; Inflight Event / Encounter Unstabilized Approach,,,Person Flight Crew; Person Air Traffic Control,In-flight,Air Traffic Control Issued Advisory / Alert; Aircraft Equipment Problem Dissipated; Flight Crew Took Evasive Action; Flight Crew Became Reoriented,ATC Equipment / Nav Facility / Buildings; Aircraft,Ambiguous,"I was the Captain and flying pilot on [a flight to] EINN. This event occurred during the approach phase of flight in VMC and light winds. After coast in off the NATs we were advised of radar contact and subsequently cleared direct to ELPOM; the IF for ILS or LOC Runway 06. We were cleared for several descents with a final clearance to descend to 3000 ft. on 1031 hectopascals. At 3000 ft. outside ELPOM I began to slow for the approach and we were cleared for the ILS Runway 06. With the autopilot still engaged I armed the approach and checked the FMA to see that LOC and GS were armed. Moments later the LOC and GS captured at exactly the same time and our ASA switched to NO AUTOLAND while our raw data GS indicator began acting erratic. As we were in VMC conditions with the FMA confirming LOC and GS capture and I had the runway visually I elected to continue the approach despite the anomalies. At about 2600 ft. with reference to outside cues I lost confidence in the Glide Slope indication I was following and confirmed my concerns with my First Officer. I disengaged the autopilot and began a climb back to 3000 ft. to reestablish a visual approach and try and recapture a true Glide Slope. At that time we received a low altitude alert from Shannon Control. We advised Control we understood and confirmed we were returning to 3000 ft. I continued to fly the approach visually as the First Officer turned both FDs off then on in an attempt to reestablish some instrument guidance for the approach. At the final approach fix of ASGON with the approach reprogrammed by the First Officer all indicators began to settle down and the GS indication on the FD seemed to be giving me guidance I could trust. I continued the approach to an uneventful landing and taxied to gate; after completion of the parking check list; the First Officer and I debriefed the event.",,"I was the First Officer as the pilot monitoring and the Captain the pilot flying. After crossing the Atlantic in EINN approach sector. We were cleared to the initial fix ELOPM for ILS 06 at 3000 ft.; the aircraft was level with 3000 ft. selected in MCP altitude window with LNAV to ELOPM and approach mode armed; at about 19 miles to runway we began to slow the aircraft for approach with the autopilot engaged. And was trying to visually acquire the airfield. The autopilot captured the localizer; simultaneously the autopilot also captured a false glide slope; the ASA indicated 'no auto land'; the raw data glide-slope was erratic and the aircraft descended to approximately 2650 ft. The Captain and I recognized the aircraft descending and the Captain disconnected the autopilot and climbed aircraft back to 3000 ft. ATC advised of an altitude alert. After recovering to 3000 ft. the Captain continued to hand fly and upon reaching final approach fix raw data and flight director indicated appropriate data and landing was accomplished without further incident.",,"Air carrier flight crew reported receiving a low altitude alert from ATC on approach to EINN.",
1888668,202203,1201-1800,ZZZ.Airport,US,,,,,,VMC,,,Daylight,,,TRACON ZZZ,Air Carrier,B737-800,,2,Part 121,IFR,Passenger,,Descent; Initial Approach,,Class B ZZZ,,,,,,,,,,,,,,,,,,,,,,,,MCP,,X,Malfunctioning,,,,,,,,,,,,,,,,,,,,,,,,,,,,,,,,,,,,Aircraft X,Flight Deck,Air Carrier,Pilot Not Flying; First Officer,Flight Crew Multiengine; Flight Crew Instrument; Flight Crew Air Transport Pilot (ATP),,,Troubleshooting; Workload; Confusion; Situational Awareness,,,1888668,Aircraft X,Flight Deck,Air Carrier,Pilot Flying; Captain,Flight Crew Instrument; Flight Crew Air Transport Pilot (ATP); Flight Crew Multiengine,,,Workload; Troubleshooting; Confusion; Situational Awareness,,,1888652,Aircraft Equipment Problem Less Severe; Deviation - Speed All Types; Deviation / Discrepancy - Procedural Clearance; Deviation / Discrepancy - Procedural Published Material / Policy; Inflight Event / Encounter Unstabilized Approach,,N,Person Flight Crew,In-flight,Air Traffic Control Provided Assistance; Flight Crew Requested ATC Assistance / Clarification; Flight Crew Landed in Emergency Condition; Flight Crew Overcame Equipment Problem,Aircraft,Aircraft,"Descending from 10;000 to 6;000; ATC instructed us to slow to 210 kt. The Captain selected LVL CHG and tried to set the speed with the IAS/MACH knob on the MCP (Mode Control Panel). He then noted that the airspeed would not change with the IAS/MACH knob on the MCP. All three airspeed indicators matched so we knew it was not airspeed unreliable. We tried different vertical modes and turned the autothrottle off and back on and still could not change the speed with the IAS/MACH knob on the MCP. We finally decided to [request priority handling] as a precaution and turned off the autopilot and autothrottles and continued the approach. We landed without incident. At touchdown the MCP speed indicated 193 kt. but aircraft speed was at VREF+5. [I suggest to] maintain aircraft.",,"On arrival into ZZZ for Runway XXR; Approach cleared us to a lower altitude and airspeed off the published arrival. I selected LVL CHG on the MCP (Mode Control Panel) and started the descent [and] then I selected the slower assigned airspeed within the IAS/MACH window on the MCP. As I rotated the knob; the airspeed did not change. I then turned the autothrottle off and back on with the speed still not responding when rotating the knob. Hence; with the autopilot engaged; the aircraft was maintaining the airspeed stuck in [the] window. I then turned off autopilot and autothrottle and manually descended and slowed the aircraft to what Approach has assigned us.It was then [that] Approach turned us onto base and cleared us to a lower altitude and airspeed and switched us to Tower after clearing us for a visual approach to XXR. We then decided to [request priority handling] as a precaution. Tower asked us if we wanted to land on the longer Runway XXL and if we wanted AARF (airport rescue and fire fighting) to respond. I answered in the affirmative to both offers. As we were maneuvering to XXL; we confirmed we had reliable airspeed. During this time the FO (First Officer) dialed in the ILS frequency and I slowed and configured early; captured the LOC and GS; and landed without incident. The vertical and lateral guidance in HUD was accurate but the airspeed cues were not. The airspeed bug and airspeed carrot were based on airspeed stuck in IAS/MACH window on MCP. After landing and clearing the runway; we cancelled the [priority handling]. By the way; FO Name did a fantastic job backing me up; running the appropriate checklists and radios; and making great suggestions.",,"Air carrier flight crew reported loss of airspeed control on approach. The flight crew disconnected the autopilot and autothrottles systems and continued the approach and landing.",
1889004,202203,1201-1800,ZZZ.Tower,US,,,1400,,,VMC,1,,,120,,Tower ZZZ,FBO,Small Aircraft; Low Wing; 1 Eng; Fixed Gear,,1,Part 91,VFR,Training,,Final Approach; Initial Approach; Landing; Takeoff / Launch,Direct; Visual Approach,Class D ZZZ,,,,,,,,,,,,,,,,,,,,,,,,Turn/Bank Indicator,,X,Malfunctioning,,,,,,,,,,,,,,,,,,,,,,,,,,,,,,,,,,,,Aircraft X,Flight Deck,FBO,Trainee; Pilot Flying,Flight Crew Student,Flight Crew Last 90 Days 22; Flight Crew Type 90,,Workload; Training / Qualification; Time Pressure; Situational Awareness; Other / Unknown; Confusion; Communication Breakdown,Party1 Flight Crew; Party2 Other,,1889004,Aircraft X,,FBO,Instructor,Flight Crew Multiengine; Flight Crew Instrument; Flight Crew Flight Instructor; Flight Crew Commercial,Flight Crew Last 90 Days 230; Flight Crew Total 1470; Flight Crew Type 480,,Communication Breakdown; Time Pressure; Situational Awareness; Workload; Troubleshooting; Confusion; Other / Unknown,Party1 Flight Crew; Party2 Other,,1888932,Aircraft Equipment Problem Critical; Deviation / Discrepancy - Procedural Published Material / Policy; Ground Event / Encounter Ground Strike - Aircraft; Ground Event / Encounter Loss Of Aircraft Control; Inflight Event / Encounter Unstabilized Approach,,N,Person Flight Crew,,Air Traffic Control Provided Assistance; Flight Crew Requested ATC Assistance / Clarification; Flight Crew Returned To Departure Airport,Aircraft; Human Factors,Ambiguous,"I was the Pilot in Command. I was going to conduct a solo cross country from ZZZ1 to ZZZ2 to ZZZ3 and return to ZZZ1. I conducted my pre-flight check in accordance with the Pilot's Operating Handbook. I did not discover any issues. I then contacted ZZZ1 Ground Control and requested and was approved for my run-up. I proceeded to the north end of Alpha 1 to conduct my run-up. I conducted my run-up in accordance with the POH and again did not discover any issues. I had no difficulty in taxing from the FBO to the run-up area. I obtained clearance from ZZZ1 Ground Control to proceed to Runway XX and hold short. I again did not experience any difficulty in taxing from the run-up area to the holding area of Runway XX. I contacted the ZZZ1 Tower and advised them I was holding short of Runway XX. The Tower cleared me to proceed to Runway XX and take off to right traffic.I taxied onto Runway XX and proceed to take off and climb. The airplane immediately began to yaw to the left despite my using the right rudder pedal to compensate for the left turning tendency caused by the P-factor; but the airplane continued to yaw to the left. I reached an altitude of approximately 1;400 ft. and began a 30-degree right turn. The airplane continued to become unstable. I noticed the ball in the turn coordinator was all the way to the right. I applied more right rudder to correct but the airplane but it to the left and then right. The rudder pedals weren't responsive to my input to control the yawing. I was experiencing difficulty in maneuvering the airplane and staying in a straight and level flight at which time I felt it was in my best interest to return to ZZZ1. I contacted the Tower and advised them that I was experiencing rudder control and needed to immediately return. Tower asked if I could do return and land on Runway XY. I advised Tower that I didn't believe I could affect a turn and land on Runway XY and would attempt to land on Runway XX. I entered the right pattern for a landing on Runway XX and continued to have difficulty maintaining a straight and level flight. I paralleled Runway XX (Downwind). I decreased the RPM from 2350 to 1700 when I was aligned with the north end of Runway XY. I then attempted a 30 degree right turn onto base when I was 45 degrees with the numbers for Runway XX and began my decent. I was having difficulty effecting the turn and turn for the final for Runway XX.I overshot and approached Runway XX at 45-degrees. My airspeed was 85 KTS. I was aware this to 10 KTS over the approach and recommending landing speed. I considered a go-around but didn't believe I would be able to safely do so. I reduced the power to idle as I entered the runway; brought the nose up to reduce airspeed; landed hard on the rear wheels; bounced up and came down on the front wheel and began to porpoise. I again; did not believe I could effectively increase power and safely do a go-around once I began to porpoise. I taxied back to the FBO and reported the incident to the office personal and the mechanics. I was unaware until informed by the owner and operator of the FBO that I had a propeller strike.I have approximately 85 hours of dual instruction flight time and 4 hours solo and never experienced this type of airplane instability with my instructors or since I began soloing. This was my second time flying this aircraft. I familiarized myself with this aircraft previously and on this date prior to departing the FBO. This was flight was to be my second cross-country flight. My prior flights with my instructors and since soloing have been without incident.",,"On student solo cross country; student pilot encountered difficultly maintaining directional control shortly after departure on the upwind traffic pattern leg. Student pilot elected to return for landing. Student pilot notified ZZZ Tower. Tower cleared student pilot to land on Runway XX. Student pilot had a final approach speed of 85 KTS or greater. The Pilot Operating Handbook dictates a final approach speed of 75 KTS. Student pilot encountered a proposed landing and subsequent propeller strike with the ground. Student pilot remained within the runway and no runway excursions were encountered. Student pilot cleared the runway; then taxied back to the flight school. Student pilot did not initially report or notice the propeller contact until damage was found at a later visual inspection. This report was made by the student pilot's flight instructor. It is unclear how the initial problem of maintaining directional control arose. Student pilot stated the inclinometer was swinging full deflection to the left and right. Instructor believes a contributing factor could be over controlling of the rudder. Another contributing factor leading to the propeller strike is excessive speed on final approach. Weather reports VFR conditions; clear skies; winds less than 10 KTS favoring the runway direction.",,"Student Pilot reported having difficulty controlling the aircraft's yaw during climb out and landing. The Student Pilot landed hard and the propeller contacted the runway.",
1889149,202203,1801-2400,ZZZ.Airport,US,,,200,,,,,,,,,Tower ZZZ,Air Carrier,B737 MAX Series Undifferentiated,,2,Part 121,IFR,Passenger,GPS; FMS Or FMC,Final Approach,Visual Approach,Class C ZZZ,,,,,,,,,,,,,,,,,,,,,,,,,,,,,,,,,,,,,,,,,,,,,,,,,,,,,,,,,,,,,,,Aircraft X,Flight Deck,Air Carrier,Pilot Flying; Captain,Flight Crew Air Transport Pilot (ATP); Flight Crew Multiengine; Flight Crew Instrument,,,Situational Awareness; Other / Unknown; Human-Machine Interface; Confusion; Communication Breakdown; Distraction,Party1 Flight Crew; Party2 Flight Crew,,1889149,Aircraft X,Flight Deck,Air Carrier,First Officer; Pilot Not Flying,Flight Crew Multiengine; Flight Crew Instrument; Flight Crew Air Transport Pilot (ATP),,,Situational Awareness; Distraction; Fatigue; Confusion; Communication Breakdown; Other / Unknown,Party1 Flight Crew; Party2 Flight Crew,,1889162,Deviation / Discrepancy - Procedural FAR; Deviation / Discrepancy - Procedural Published Material / Policy; Flight Deck / Cabin / Aircraft Event Other / Unknown; Inflight Event / Encounter Unstabilized Approach,,,Automation Aircraft Other Automation; Person Flight Crew,In-flight,Flight Crew Became Reoriented,Human Factors,Human Factors,"On short final during a visual approach to Runway XXL at ZZZ we were alerted by a GPWS audible annunciation of 'Too Low; Flaps' at approximately 200 ft. AGL. I was hand flying the aircraft at the time and stated to the First Officer; 'We are at flaps 30; right? He took a look and said no; we're at 25; and simultaneously moved the flap lever to the 30 degree position. We proceeded to complete the approach and landing uneventfully.We were flying a 737 MAX; which is rare for me; and I initially wasn't sure if I wanted to set up the flight instrument displays so that the engine instruments and flaps display were on my Multi-function Flight Display or the First Officer's. I opted to have them on the First Officer's side and have a larger map display on my side. This put the flap display further from my view. We had completed the before landing checklist at approximately 2;000 ft. AGL; and both of us thought we had verified flaps at 30 degrees; but apparently we were still at 25. The First Officer mentioned he might have gone to flaps 10 when I called for 15; and then was behind by one notch for each subsequent call. I believe when I called for flaps 30; the lever was moved from 15 to 25; and regrettably; neither of us caught the discrepancy. The approach remained stable throughout the incident. In retrospect; upon receiving the alert; we should have executed a go-around. This would have prevented us from making a configuration change below the standard 1;000 approach criteria. In the future; I'll also be more careful to take a close look at the flap indication for each setting; and set up the Multi-function Flight Display so that when I'm the flying pilot on the MAX; I'll keep the gauges displayed closer to me to facilitate an accurate reading.",,"On short final to Runway XXL visual approach to ZZZ we were alerted by the GPWS warning flaps too low at approximately 200 ft. AGL. I was non flying pilot. Captain asked if we were flaps 30 and I stated no and put the flaps to 30 degrees. We continued and landed uneventfully. I had an early commute coupled by a delay making a long day longer and flying a 737 MAX; which I see once in a while. Upon configuration when the pilot called for flaps 15 I believe I selected flaps 10 thus when flaps 30 was called I selected flaps 2. Being very tired I didn't catch this and even on the check list neither of us caught the flaps not being at 30. Leaving I felt fine but a half hour before landing became tired. Should have emphasized that to the Captain on the brief that I am tired and back me up. When tired double check checklist items.",,"B737 MAX flight crew reported an unstabilized approach and associated GPWS warning due to flap misconfiguration. The flight crew set flaps correctly and continued to landing.",
