1904047,202205,1801-2400,CLT.Tower,NC,,,,,,,,,,,,Tower CLT,Air Carrier,Medium Transport; Low Wing; 2 Turbojet Eng,,2,Part 121,IFR,Passenger,FMS Or FMC,Landing; Final Approach,,Class B CLT,,,,,,,,,,,,,,,,,,,,,,,,Radio Altimeter,,X,Malfunctioning,,,,,,,,,,,,,,,,,,,,,,,,,,,,,,,,,,,,Aircraft X,Flight Deck,Air Carrier,Pilot Flying; Captain,Flight Crew Instrument; Flight Crew Air Transport Pilot (ATP); Flight Crew Multiengine,,,Human-Machine Interface; Time Pressure; Troubleshooting,,,1904047,,,,,,,,,,,,Aircraft Equipment Problem Less Severe; Deviation / Discrepancy - Procedural Clearance; Deviation / Discrepancy - Procedural Published Material / Policy; Inflight Event / Encounter Unstabilized Approach,,,Person Flight Crew,In-flight,Flight Crew Executed Go Around / Missed Approach; General Maintenance Action,Environment - Non Weather Related; Aircraft,Ambiguous,"I was flying with a brand new First Officer (FO). We were talking about the weather and I had mentioned that the previous trip I had to do an auto land in ZZZ due to fog. He said that he had never done one. I told him that when we got to CLT; to ask for 18R and that we were trying to demo an auto land. ATC changed our runway so we could do it. As the RA (Radio Altimeter) said 50; I auto land red warning light illuminated and I performed a go around. We were vectored back to 18R but performed a normal ILS. As soon as we touched down; we received a [Radio Altimeter error] message. Maintenance was notified and I made appropriate entry on AML (Aircraft Maintenance Log). The one thing I did during the GA (Go Around) was I disconnected the AP and did a manual GA. The reason why I disconnected the AP at such an extreme low altitude was because I was not sure if the problem was the AP itself and did not wanted to take a chance.",,,,"Air carrier Captain reported on autoland approach; receiving radio altimeter error messages both on approach and landing.",
1905032,202205,0001-0600,ZZZ.Airport,US,,,400,,,VMC,,,,,,Tower ZZZ,Air Carrier,B737 Undifferentiated or Other Model,,2,Part 121,IFR,Passenger,,Final Approach,,Class B ZZZ,,,,,,,,,,,,,,,,,,,,,,,,Flap/Slat Control System,,X,Improperly Operated,,,,,,,,,,,,,,,,,,,,,,,,,,,,,,,,,,,,Aircraft X,Flight Deck,Air Carrier,First Officer; Pilot Not Flying,Flight Crew Air Transport Pilot (ATP); Flight Crew Instrument; Flight Crew Multiengine,Flight Crew Last 90 Days 29; Flight Crew Type 29,,,,,1905032,,,,,,,,,,,,Aircraft Equipment Problem Less Severe; Deviation / Discrepancy - Procedural Published Material / Policy; Inflight Event / Encounter Unstabilized Approach; Inflight Event / Encounter CFTT / CFIT,,,Automation Aircraft Other Automation; Person Flight Crew,In-flight,Flight Crew Executed Go Around / Missed Approach,Procedure; Aircraft; Human Factors,Human Factors,"On visual approach into ZZZ; I was the pilot monitoring. When the pilot flying called for flaps 30; I inadvertently selected flaps 25 and did not catch the error during the landing checklist. At approximately 400 ft. AGL; the alert 'Too Low; Flaps' sounded in the flight deck. The pilot flying immediately called for a go around; and we executed the go around and received radar vectors for another visual approach. We landed on our second approach without incident.",,,,"B737 First Officer reported failure of proper flap selection resulted in low altitude; flaps alert and go-around.",
1906163,202206,0601-1200,ZZZ.Tower,US,,,,,,VMC,,,Daylight,,,Tower ZZZ,Air Carrier,A319,,2,Part 121,IFR,Passenger,,Final Approach,Vectors,Class B ZZZ,,,,,,,,,,,,,,,,,,,,,,,,Trailing Edge Flap,,X,Malfunctioning,,,,,,,,,,,,,,,,,,,,,,,,,,,,,,,,,,,,Aircraft X,Flight Deck,Air Carrier,First Officer; Pilot Flying,Flight Crew Multiengine; Flight Crew Instrument; Flight Crew Air Transport Pilot (ATP),Flight Crew Last 90 Days 65; Flight Crew Total 3651; Flight Crew Type 3651,,Troubleshooting,,,1906163,Aircraft X,Flight Deck,Air Carrier,Captain; Check Pilot; Pilot Not Flying,Flight Crew Multiengine; Flight Crew Instrument; Flight Crew Air Transport Pilot (ATP),Flight Crew Last 90 Days 95; Flight Crew Total 2060; Flight Crew Type 2060,,Troubleshooting,,,1906162,Aircraft Equipment Problem Critical; Deviation - Speed All Types; Deviation / Discrepancy - Procedural Clearance; Inflight Event / Encounter Unstabilized Approach,,N,Automation Aircraft Other Automation; Person Flight Crew,In-flight,Air Traffic Control Provided Assistance; Flight Crew Landed As Precaution; Flight Crew Overcame Equipment Problem; Flight Crew Requested ATC Assistance / Clarification; General Flight Cancelled / Delayed; General Maintenance Action,Aircraft,Aircraft,"This was a scheduled IOE flight from ZZZ1 to ZZZ for my Captain upgrade. I was listed as the First Officer even though I was flying in the left seat and acting as Captain. During this flight we planned to do a Flaps 3 landing into ZZZ for training. We had a 45 minute delay out of ZZZ1 due to a low green hydraulic fluid indication on the systems page. ZZZ1 has contract maintenance and the maintainer had to be called to report to the airport. Once the maintainer arrived 45 minutes after the initial call he serviced the green hydraulic system and we boarded the aircraft. The rest of the departure from ZZZ1 was uneventful. We had an uneventful arrival into ZZZ; briefed the Flaps 3 landing; and configured the GPWS and FMGC for the Flaps 3 landing. We were vectored for a visual approach to Runway to Runway XXR; which we would back up with the ILS for XXR. Once we were cleared the approach we were told to maintain 170 kts. to ZZZZZ and call Tower. At this point on the approach I disconnected the autopilot and had the LCA lower the Flaps from 1 to 2. While descending on the glide slope and about a mile prior to ZZZZZ I called for Flaps 3 at which time we received an ECAM for F/CTL Flaps Fault and the flaps remained at setting 2 with the flap lever set to setting 3. We made the decision to execute a go-around; [request priority handling] with Tower and get vectors to run the ECAM. At this point I decided to go to TOGA to put the aircraft in go-around mode; we still had not extended the gear and the flaps were stuck at setting 2. The acceleration in TOGA and my lack of following the command bars quickly enough caused an overspeed of 5 kts of the flaps before I was able to increase the pitch into the command bars and manually reduce the thrust. Tower gave us a climb to 9;000 ft. and a vector eastbound as I corrected the airspeed. On the vector eastbound I continued to fly the aircraft. Upon leveling at 9;000 ft.; I re-engaged the auto thrust to maintain 170 kts and also re-engaged the autopilot. I retained control of the aircraft and took over radios while the LCA ran the ECAM. The first part of the ECAM has us return the Flap lever to the previous setting at which time the entire ECAM disappeared not allowing us to complete the rest of the ECAM. After the ECAM had disappeared I transferred the aircraft to the LCA so that I could brief the flight attendants and then the passengers. I gave a briefing to the flight attendants. Once I had completed my briefings I opened the Flight Manual to F/CTL FLAPS FAULT since we no longer had the ECAM to reference. At step 2 of the procedure we returned the flap lever to position 3; which had caused the original ECAM. This time we were able to extend the flaps to position 3 without an ECAM. We both agreed that we could land on the original Runway of XXR with a Flap 3 configuration and relayed this to approach. We also told them that we had fixed our flight control issue; but did not attempt to cancel the [priority handling request]. We were vectored back to Runway XXR for an uneventful landing. Upon landing emergency vehicles were standing by; but no inspection was required and we were given instructions to taxi to Gate XX. We had also coordinated with dispatch to contact maintenance and see if they wanted us to leave the flaps at setting 3 after landing and into the Gate for an inspection. They told us to do exactly that; so after Landing flows were completed with the exception of bringing the flaps up. I taxied the aircraft to the Gate and maintenance was waiting to debrief us. I also completed a debrief with the flight attendants to make sure they were comfortable with how they were kept informed during the event; they said they were. At this point the LCA and I agreed that because of all of these events that we were unable to continue with the remaining two legs of the trip and we needed to debrief the incident. We called the Chief pilot and we were re-assigned to a deadhead back to ZZZ2 later inthe day.",,"Pilot in left seat was receiving initial Captain IOE with LCA in the right seat. A flaps 3 approach was briefed and set up for due to training requirements. Student Captain was established on final at Flaps 2 and selected speed 170; on course and glide slope. Student called for Flaps 3 and I moved the lever to Flaps 3. Immediately we got a F/ CTL FLAPS FAULT ECAM. I asked the Student Captain if he would like to abandon the approach to deal with the ECAM later and he said yes. I told the Controller that we would like to abandon the approach; and we were given instructions to track the localizer and climb to 9;000 ft. The altitude was reset and the Student Captain instead of calling for Open Climb taking the thrust levers to TOGA to begin the no longer used 'soft go around' procedure. Go Around call outs were not made. Thrust levers were pulled back from TOGA; but the aircraft accelerated quickly in the Flaps 2; gear up configuration and the Student Captain failed to follow Flight Director guidance. In retrospect as an LCA I should have taken the aircraft; but I instead chose to give verbal instruction to the Student. Student reacted slowly to the instruction and the flaps 2 limit speed was exceeded by about 5 kts. Student began to fly the aircraft by taking the auto thrust off and manually manipulating the thrust levers. At 9;000 ft. the aircraft was stabilized and auto thrust restored. A [request for priority handling] was made. ATC gave us vectors and the ECAM was started by the LCA. As soon as the flaps lever was returned to 2; the ECAM went away. Dispatch was notified. At first the crew considered a Flaps 2 landing; but the QRH directed returning the flap lever to 3 and this time the flaps went to 3. Student Captain completed a normal Flaps 3 landing.",,"A319 flight crew reported a trailing edge flaps fail ECAM on approach and elected to make a go around to run the QRH procedures. The flight crew successfully cleared the fault and returned to the approach and made a landing at destination airport.",
1907998,202206,0601-1200,ZZZ.Airport,US,,,0,,,Mixed,Rain; 4,,Daylight,500,,Tower ZZZ,Air Taxi,King Air C90 E90,,1,Part 135,IFR,Passenger,,Landing,,Class D ZZZ,,,,,,,,,,,,,,,,,,,,,,,,,,,,,,,,,,,,,,,,,,,,,,,,,,,,,,,,,,,,,,,Aircraft X,Flight Deck,Air Taxi,Single Pilot; Pilot Flying,Flight Crew Air Transport Pilot (ATP); Flight Crew Instrument; Flight Crew Rotorcraft; Flight Crew Multiengine,Flight Crew Last 90 Days 79; Flight Crew Total 4516; Flight Crew Type 98,,Situational Awareness; Workload; Confusion; Distraction,,,1907998,,,,,,,,,,,,Deviation - Speed All Types; Deviation / Discrepancy - Procedural Published Material / Policy; Ground Event / Encounter Loss Of Aircraft Control; Ground Event / Encounter Ground Strike - Aircraft; Inflight Event / Encounter Unstabilized Approach,,,Person Flight Crew,In-flight,Aircraft Aircraft Damaged; Flight Crew Regained Aircraft Control,Weather; Human Factors,Human Factors,"I was the PIC for a part 135 flight.  We were scheduled to leave at XA01 and the forecast conditions were for a broken ceiling at 3500 feet with a temporary condition of Broken at 2000 with 4 miles of visibility around our arrival.  I elected to file an alternate even though it was not required so I used ZZZ1 which had legal alternate filing weather.  I updated my numbers for icing the morning of the flight but anticipated being above it by changing my filed altitude from 240 to 280.  Flight proceeded uneventfully when we got close enough to the airport they were advertising GPS approaches to [runway] XX so I asked for direct ZZZZZ [Intersection] (IAF) while still approximately 70 miles away and received it.  About half way there ATC said they were having better results with XX so I was cleared direct to ZZZZZ1 [Intersection].  As we were getting near ZZZZZ1 [Intersection]; ATC switched back to XY and gave me vectors to the East. We were then cleared to ZZZZZ2 [Intersection] after doing a 270 degree turn for spacing.  We got established to ZZZZZ2 [Intersection] after clarifying I wanted Z RWY XX not Y (we already had Z in the box). I armed approach mode but set 6300 for my next step down as Garmin will not descend in VNAV until the final approach fix (ZZZZZ3 [Intersection]) is active.  I descended to 6300 and as I approached ZZZZZ3  [Intersection] set the missed approach altitude 7000.  At ZZZZZ3 [Intersection]; the aircraft did not begin descending so I turned off the autopilot and initiated a descent. Once I captured the glide path I coupled again and went back on the autopilot.  I broke out at approximately 500-600 feet and turned off the autopilot. I was high according to the VASI and tried to capture it since I was visual at this point ( VASI is not coincident with the glide path). This caused me to pick up some unintended speed and by the time I was over the numbers I was approximately 10 kts over Vref and when I flared I ballooned up more than I anticipated and used poor technique to execute a bad landing due to not being in a good flaring attitude; which caused approximately 3 porpoises before I added some power and then landed when the porpoises stopped.  Winds were 320/8 so I didn't consider them to be a large factor.  I taxied in and shut down the airplane .  I did not realize we had a prop strike till the walk around.",,,,"King Air C90 pilot reported they were fast on their approach on short final and porpoised the landing resulting in a prop strike.",
1908884,202206,1201-1800,HOU.Airport,TX,,,600,,,,,,Daylight,,,Tower HOU,Air Carrier,Commercial Fixed Wing,,2,Part 121,IFR,Passenger,,Landing,,Class B HOU,,,,,,,,,,,,,,,,,,,,,,,,,,,,,,,,,,,,,,,,,,,,,,,,,,,,,,,,,,,,,,,Aircraft X,Flight Deck,Air Carrier,Pilot Flying; First Officer,Flight Crew Multiengine; Flight Crew Instrument; Flight Crew Air Transport Pilot (ATP),Flight Crew Last 90 Days 45; Flight Crew Type 580,,Situational Awareness; Other / Unknown; Communication Breakdown; Training / Qualification,Party1 Flight Crew; Party2 Flight Crew,,1908884,Aircraft X,Flight Deck,Air Carrier,Captain; Pilot Not Flying,Flight Crew Multiengine; Flight Crew Air Transport Pilot (ATP); Flight Crew Instrument,Flight Crew Last 90 Days 150,,Communication Breakdown,Party1 Flight Crew; Party2 Flight Crew,,1908873,Deviation - Altitude Overshoot; Deviation / Discrepancy - Procedural Published Material / Policy; Inflight Event / Encounter CFTT / CFIT; Inflight Event / Encounter Unstabilized Approach,,,Automation Aircraft Terrain Warning; Person Flight Crew,In-flight,Flight Crew Took Evasive Action; Flight Crew Became Reoriented,Human Factors,Human Factors,"FO was rusty due to leave (30 days out of cockpit). Winds were 18017G25 for landing 13R at HOU. The approach was stabilized at 1;000 feet AGL. On short final FO adjusted aim-point without verbalizing; after which the Captain called 'sink rate' and subsequently there were two 'sink rate' GPWS cautions. The FO over corrected with power and under corrected with pitch. The aircraft was 15 knots above VTGT on short final. The Captain made an 'airspeed' call and FO corrected and the aircraft landed within the briefed Landing Zone. The FO considered executing a go-around but was making corrections and felt safe. Max sink rate post flight was 1;248 FPM. After landing; the aircrew agreed a go-around should have been executed due to not meeting the stabilized approach criteria.After landing; the aircrew agreed a go-around should have been executed due to not meeting the stabilized approach criteria.",,"The FO was a little rusty on this three-day pairing due to previous leave. While on short visual final to Runway 13R; the FO adjusted his aim point. He did not verbalize those intentions to me. The FO used excessive pitch; resulting in an increased sink rate. I noticed the sink rate exceeding 1;000 feet down; and called 'sink rate'. The FO increased the power but did not use a commensurate increase in back pressure on the yolk to arrest the sink rate. We received two 'SINK RATE' GPWS annunciations. Just as I was considering calling for a go-around; I assessed the aircraft to be in a safe position to land. Due to the excessive power correction in the flare; I called 'airspeed' when I observed the airspeed 15 knots above VTarget. An appropriate correction was made; and we landed prior to our briefed latest touchdown point. In hindsight; a go-around should have been accomplished because we did not meet the stabilized approach criteria.The pilot flying should verbalize their intentions to the other pilot so as to know what is expected.  A stricter adherence to SOP should be maintained (executing a go-around). Experience will come with more time spent flying on the line.",,"Air carrier flight crew reported an unstabilized approach to HOU airport resulting in a GPWS annunciation requiring immediate action from the First Officer to arrest the descent. The crew stated the First Officer was rusty due to lack of flying; which contributed to the event.",
1909164,202206,0601-1200,DEN.Airport,CO,,,,500,,VMC,,,,,,Tower DEN,Air Carrier,B737 Next Generation Undifferentiated,,2,Part 121,IFR,Passenger,,Landing,,Class B DEN,,,,,,,,,,,,,,,,,,,,,,,,,,,,,,,,,,,,,,,,,,,,,,,,,,,,,,,,,,,,,,,Aircraft X,Flight Deck,Air Carrier,Captain; Pilot Not Flying,Flight Crew Multiengine; Flight Crew Instrument; Flight Crew Air Transport Pilot (ATP),Flight Crew Last 90 Days 154.9; Flight Crew Total 18500; Flight Crew Type 8000,,Situational Awareness,,,1909164,Aircraft X,Flight Deck,Air Carrier,Pilot Flying; First Officer,Flight Crew Instrument; Flight Crew Multiengine; Flight Crew Air Transport Pilot (ATP),Flight Crew Last 90 Days 170.72; Flight Crew Type 466.82,,Situational Awareness,,,1909166,Deviation - Altitude Undershoot; Deviation - Speed All Types; Deviation / Discrepancy - Procedural Published Material / Policy; Inflight Event / Encounter Unstabilized Approach; Inflight Event / Encounter CFTT / CFIT,,,Automation Aircraft Other Automation,In-flight,General None Reported / Taken,Procedure; Human Factors,Ambiguous,"We received a clearance for a visual approach to [Runway] 35L with direct to the FAF.  I was monitoring our class B floor to ensure compliance and the FO was flying 250 knots. I stepped down his altitude as required to remain in class B. ATC  told us the airspeed was our discretion. As we approached the final marker we were high and fast.  We did not intercept the glide slope at the marker and used vertical speed to continue. At 500 feet we were stable; but I did not get our flaps to 30.  I did not hear a call and we were focused on salvaging the approach. The GPWS said 'terrain' and I thought this was an error. At 50 feet I noticed the flap gauge at 25. Our Vref was 164 knots due to gusts.  Clearly we should have gone around and I offer no excuse.",,"Expected ILS 35L at DEN; was given [Runway] 35R late in the descent. Pilot Flying changed ILS radio and minimus; however PF failed to change the runway in the ARR Page on the FMC. ILS 35R became visual 35R per approach control; which wasn't unexpected based on ATIS information.  When the omission of the ARR runway was realized and was entered we lost  vertical guidance on the PFD and added to the task saturation in the cockpit.  PF attempted to slow to from 250 to 210 at approx 7 miles from FRONZ (FAF for 35R) on a 45 deg dogleg vector off the CLASH Arrival.  Had to stay high due to Class B airspace airspeed restrictions; then was late to get down to 7000 feet by FRONZ which resulted in having to stay high and configure.  Aircraft was high at FRONZ and for the remainder of the approach into 35R.  Being high approaching FRONZ; attempted to utilize V/S Mode to capture the glide path; which resulted in a higher than necessary airspeed which then resulted in a late configuration and continuance above acceptable parameters for landing. Attempted to continue to recover the approach while still high and configuring the aircraft to a greater rate of descent to capture a stabilized approach.  By 500 feet; was in excess of 1000 feet per/minute and only Flaps 25 with 1 Red and 3 white on the PAPIs  Called for flaps 30 but did not verify flap movement and did not verify completion of landing checklist which would have precluded 'Too Low Terrain' annunciation. Continued to landing which was uneventful and within acceptable landing parameters on the runway.",,"B737 NG Flight Crew reported receiving a terrain warning on short final approach to DEN airport due to flap misconfiguration. Flight crew stated they received a late runway change which resulted in a higher-than-normal rate of descent and not completing a checklist.",
1909170,202205,0601-1200,ZZZ.Airport,US,,,200,,,VMC,,,,,,Tower ZZZ,Air Carrier,B737 Next Generation Undifferentiated,,2,Part 121,IFR,Passenger,,Final Approach,,Class C ZZZ,,,,,,,,,,,,,,,,,,,,,,,,Flap/Slat Control System,,X,Improperly Operated,,,,,,,,,,,,,,,,,,,,,,,,,,,,,,,,,,,,Aircraft X,Flight Deck,Air Carrier,Captain; Pilot Not Flying,Flight Crew Multiengine; Flight Crew Air Transport Pilot (ATP); Flight Crew Instrument,Flight Crew Last 90 Days 240; Flight Crew Total 16000; Flight Crew Type 8500,,Situational Awareness,,,1909170,,,,,,,,,,,,Deviation - Speed All Types; Deviation / Discrepancy - Procedural Published Material / Policy; Inflight Event / Encounter Unstabilized Approach; Inflight Event / Encounter CFTT / CFIT,,,Automation Aircraft Terrain Warning; Automation Aircraft Other Automation,In-flight,Flight Crew Regained Aircraft Control; Flight Crew Took Evasive Action,Human Factors,Human Factors,"Start/Taxi/Takeoff/Enroute/Descent normal.  PF flew left downwind to landing runway and was a little high on profile.  We were at Flaps 30 and I recommended Flaps 40 for 5-10 seconds to increase descent gradient to get on profile.  While flaps were at 40 we exceeded the Flap speed and they began to blow up.  I did not realize they were in the process of blowing up and as we had achieved normal gradient I asked PF if I could move flaps to 30.  He concurred; unfortunately the blowup from overspeed was still occurring and the flap remained at 25.At approximately 200 feet we received the 'Too Low Flaps' GPWS and I saw flaps at 25; flap handle in detent at 30 and elected to increase PF's approach speed and disable GPWS system.Landing/taxi in/shut down uneventful; maintenance write up was made.",,,,"B737 Captain reported a flaps overspeed resulting in a 'Too Low Flaps' GPWS warning at 200 feet.  The Captain decided to increase the approach speed and continue the landing.",
