1934023,202209,1201-1800,,,,,,8000,,VMC,,,,,,,Air Carrier,B787 Dreamliner Undifferentiated or Other Model,,4,Part 121,,Passenger,,Final Approach,,,,,,,,,,,,,,,,,,,,,,,,,,,,,,,,,,,,,,,,,,,,,,,,,,,,,,,,,,,,,,,,,Aircraft X,Flight Deck,Air Carrier,First Officer; Pilot Not Flying; Relief Pilot,Flight Crew Multiengine; Flight Crew Instrument; Flight Crew Air Transport Pilot (ATP),Flight Crew Last 90 Days 160; Flight Crew Total 16403; Flight Crew Type 1124,,Situational Awareness,,,1934023,Aircraft X,Flight Deck,Air Carrier,Captain; Pilot Flying,Flight Crew Multiengine; Flight Crew Instrument; Flight Crew Air Transport Pilot (ATP),Flight Crew Last 90 Days 104; Flight Crew Total 2201; Flight Crew Type 872,,Situational Awareness,,,1934032,ATC Issue All Types; Deviation - Speed All Types; Deviation / Discrepancy - Procedural Published Material / Policy; Inflight Event / Encounter Loss Of Aircraft Control; Inflight Event / Encounter Unstabilized Approach,,,Automation Aircraft Other Automation; Person Flight Crew,In-flight,Flight Crew Regained Aircraft Control,Procedure; Human Factors,Human Factors,"The Captain was the Pilot Flying (PF). The First Officer (FO) was the Pilot Monitoring (PM). I was the Relief First Officer in the primary (center) jump seat. A Relief Captain was in the 2nd observer's seat. The Relief Captain had a limited view. Each of us most likely has a different vantage point of the events of this approach and landing.This flight was in the evening and we were in day VFR conditions with an ILS approach in ZZZZ after a more than a 14 hour flight. We planned and briefed for an ILS/visual to XXL in ZZZZ at altitude. Usually; we request to switch from XXL to YYR with approach control and they honor the request.  We discussed doing this. Upon checking in with Approach Control and requesting XXL; ATC advised us to expect XXR. The Captain and First Officer reprogrammed the FMS and briefed YYR.  As we were getting close to the airport; the controllers asked if we wanted XXL. The Captain said to the FO that they would accept YYL. The FO programmed the FMC again and verified the minimums were changed correctly. This led to the PM FO being in the box heads down for a moment and the PF and PM doing a quick rebrief of the newly accepted runway assignment. This may have led to the string of events that followed on the approach.ATC gave us a vector to intercept the ILS YYL but it was a late vector and it was apparent we would fly through the localizer. It was a bad vector by ATC. The Captain turned off the autopilot and the auto throttles were still engaged but in hold mode and were at the idle position. Our vertical mode was FLCH and our lateral mode was heading select. The approach mode was armed LOC and G/S. The Captain made a left turn to join the localizer. As we flew through the localizer the Captain increased the bank angle possible in an attempt to help join the localizer. Bank angle rapidly increased beyond 30 degrees and the PFD turned amber in the area of the sky pointer. We heard the GPWS warning 'bank angle'. I am not sure if we exceeded 45 degrees; but the airplane's bank angle was quickly reduced to 30 degrees or less before anyone could say anything. I don't know if it was the PF or the airplane's protection system that accomplished this reduction in bank angle. We did rejoin the localizer and our clearance was to descend to 8;000 ft. until established; cleared for the ILS YYL. We were below the glideslope but above 8;000 ft. descending. Airport elevation is 5;558 ft. At one point in this approach; the airspeed was getting below the flap limit speed and the FO PM asked the Captain if they wanted more flaps.  The Captain commanded a flap setting of 20. Once again we slowed below the flap limit speed while descending and I the Relief Pilot said airspeed at least once.  The airspeed was at a minimum of 10 knots below flap speed and may have been quite a bit more before eventually being corrected. The Captain was flying the aircraft outside of the flight path commanded by the pitch bar on the flight director. We never slowed to the point where the autothrottles woke up and went in to speed mode. I told the Captain that [it is in] FLCH and the autothrottles were at idle; indicating they needed to adjust [the] pitch for the proper airspeed or manually add thrust. There was a heightened level of focus by myself on this incorrect airspeed for our configuration. It was corrected but may have been below the flap limit speed more than once.We did intercept the glideslope and the autothrottles went to SPD mode; again controlling the airspeed.  We were fully configured and the landing checklist was complete but the Captain had still not asked for the airspeed to be set to our target approach speed. The PM FO did after an appropriate amount of time;  ask the Captain if they wanted to set approach speed. At that point the Captain did ask for Target Speed. The approach was on profile from that point.  The Captain did start the flare high. [The aircraft] did float for some distance. The Relief Captain did saysomething to the effect of just put it down. This is a long runway but at a high altitude. We floated some more. I considered giving the go-around command but in that split second I paused for the following reasons - I did not want to interject more variables into the flare. The low altitude we had been at for a while in the flare and the possibility of a balked landing go around; the length of runway remaining (even though we were at a high-altitude airport.)  My personal assessment initially was that a landing may be the safest course of action versus an attempted go-around considering the previous events on the approach and our imminent touchdown due to our decaying energy state. As I continued to assess a go-around command; we did touch down. I believe we touched down past the touchdown zone.",,"The events occurred while flying the approach into ZZZZ. This was my first time actually being the Pilot Flying (PF) though I've been there three other times as the Relief Captain. We initially briefed the ILS Y to XXL before the TOD; even though the ATIS said the ILS W to YYR. The rest of the crew stated that at that time of the evening; we usually get to switch to the XXL. Sounded like a great plan. But once we talked to the Arrival Controller he reiterated the ILS to YYR. So the Pilot Not Flying (PNF) built the YYR ILS in the box. And I subsequently briefed the ILS to said runway. When the Approach Controller took over we again asked for XXL. He stated they were using XXL for departures and YYR for approaches. So I completely switched my brain to YYR. The Approach Controller gave us free speed and a right turn onto the downwind. The approach controller also gave us a descent to 9;000 ft.; the initial approach altitude. Not sure how long we stayed on downwind but then he says; would you still like to switch to XXL. PNF looks at me; I answer yes; he confirms yes to the controller and now we're scrambling to put in the new runway; brief and change the DA. He has us tight to the XXL downwind with a wind also out of the northwest blowing us even tighter.We are also 1;000 ft. higher for this runway and given a tight turn to intercept the final; and cleared for the ILS Y to XXL. It was at that time I felt compelled to click off the autopilot and hand fly it onto final. I believe this is also when the authothrottles were kicked off. I commenced the turn and in my haste to catch the course; I got a momentary 'BANK ANGLE' EICAS. I corrected and then the controller gave us another heading because we are going through the final approach course. We're high;  so I start down and continue to configure. I also drop the gear and put the flaps to 20. The speed got slightly slow. I saw it 5 knots slow while one of the relief pilots thought it was much slower. But it was slow compared to the speed set in the MCP; not the flap setting. I get my final flaps and drive to the GS intercept from below. By this point the aircraft was stable; above 1;500 ft. AGL. We rode the glideslope down; on speed; on course. I shifted my aimpoint slightly and that coupled with the altitude of the airport (5;558 ft.) caused me to land a little past the touchdown zone. The runway is 1X;XXX ft. long. I verbalize to the crew; we're going to land little long. We touch down and exit the runway at one of the briefed taxiways. Taxi to gate and debrief mistakes and errors.",,"B787 air carrier flight crew reported unstabilized approach.",
1935630,202209,0001-0600,ZZZ.Airport,US,,,,1400,,VMC,,,,,,Tower ZZZ,Air Carrier,B737 Next Generation Undifferentiated,,2,Part 121,IFR,Passenger,,Final Approach,,Class B ZZZ,,,,,,,,,,,,,,,,,,,,,,,,Flap/Slat Indication,,X,Malfunctioning,,,,,,,,,,,,,,,,,,,,,,,,,,,,,,,,,,,,Aircraft X,Flight Deck,Air Carrier,Captain; Pilot Not Flying,Flight Crew Instrument; Flight Crew Multiengine; Flight Crew Air Transport Pilot (ATP),Flight Crew Last 90 Days 98; Flight Crew Type 277,,,,,1935630,,,,,,,,,,,,Aircraft Equipment Problem Critical; Inflight Event / Encounter Unstabilized Approach,,,Automation Aircraft Other Automation; Person Flight Crew,In-flight,Flight Crew Landed As Precaution; General Maintenance Action,Aircraft,Aircraft,"The first officer was flying and we were cleared for the visual approach to Runway XR at ZZZ. At approximately 1400 ft AGL; we saw that both flap needles had stopped at 25 but the flap lever was in the flaps 30 decent. It took a moment as we confirmed that the hydraulic pumps were all on and that we really did have an issue. I told the FO (first officer) that I would need him to do a slow controlled go-around and that we will not raise the flaps and don't accelerate past 180 knots. At approximately 1000 feet; I called for a go-around as briefed. The FO flew while I talked and ran checklists. I informed the tower that we would need some vectors to work out a flap issue. We confirmed and accomplished the 'Flaps-Trailing Edge Flap Disagree' non-normal checklist. I tried to use the Dispatch 'call me' function on ACARS but was unsuccessful. This all took several minutes and we did not have fuel for further delay. After briefing the arrival; I told tower that we were ready to proceed to the field and that we were going to perform a normal landing. I did not feel it was necessary to [request priority]. I informed the Flight Attendants of our situation and that we were proceeding back to the ZZZ for a normal landing.  I also made an announcement reassuring the passengers. The FO flew a visual approach to Runway XR and made a flaps 15 landing. After landing; we did not move the flap lever. We taxied to the gate without further incident.",,,,"B737 Captain reported a flaps disagree indication resulted in a precautionary landing.",
1936176,202209,0001-0600,D01.TRACON,CO,,,,2000,,Mixed,,,Night,1000,,TRACON D01,Air Carrier,B737-700,,2,Part 121,IFR,Passenger,,Initial Approach,,Class B DEN,,,,,,,,,,,,,,,,,,,,,,,,,,,,TRACON D01,Air Carrier,Commercial Fixed Wing,,,Part 121,IFR,,,Final Approach,,Class B DEN,,,,,,,,,,,,,,,,,,,,,,,,Aircraft X,Flight Deck,Air Carrier,Pilot Flying; Captain,Flight Crew Multiengine; Flight Crew Air Transport Pilot (ATP); Flight Crew Instrument,Flight Crew Last 90 Days 150; Flight Crew Type 16000,,Confusion,,,1936176,Aircraft X,Flight Deck,Air Carrier,Pilot Not Flying; First Officer,Flight Crew Air Transport Pilot (ATP); Flight Crew Instrument; Flight Crew Multiengine,Flight Crew Last 90 Days 150; Flight Crew Type 6000,,Distraction,,,1937185,Inflight Event / Encounter Wake Vortex Encounter; Inflight Event / Encounter Unstabilized Approach,,,Person Flight Crew,In-flight,General None Reported / Taken,Procedure; Environment - Non Weather Related,Ambiguous,"We were established on the Localizer for Runway 16L and cleared for the approach. Simultaneously; we experienced wake turbulence and a temporary loss of Flight Director and ILS signal. I thought the signal could be blocked by the preceding aircraft. We advised ATC; but immediately regained all information. I elected to continue the approach; but the disruption and distraction possibly got us temporary unstabilized. We acquired the runway shortly after; and continued visually for a normal landing.There was a lot of confusion at the time of the event. We debriefed after parking and agreed that a go-around would have been the best course of action. I would like to mention that there was additional confusion about selecting other modes.",,"We were cleared for the approach on the ILS to Runway 16L to DEN. At about 2000 [ft.] AGL; we experienced what we thought of as wake turbulence from the aircraft in front of us and loss of ILS signal; which caused the Flight Director to disappear and the Autopilot disengaged. I advised ATC; at which time everything on the ILS returned and the wake turbulence stopped. The Captain was flying and decided to continue. All of this happened within just a couple of seconds and as soon as everything returned; we could see the runway. We may have become unstabilized during that short time period.We were surprised by the loss of the ILS; Flight Director; turbulence and autopilot disengagement all at the same time. When we were at the gate we talked about it and both agreed we should have just gone around and figured out what exactly was going on.",,"Air Carrier B737-700 flight crew reported temporary loss of the Flight Director and ILS signal during a wake turbulence encounter on approach to DEN",
1936552,202209,1801-2400,ZZZ.TRACON,US,,,,,,VMC,,,Dusk,,,Tower ZZZ,Air Carrier,Regional Jet 700 ER/LR (CRJ700),,2,Part 121,IFR,Passenger,FMS Or FMC; GPS,Final Approach; Initial Approach,Direct,Class C ZZZ,,,,,,,,,,,,,,,,,,,,,,,,,,,,,,,,,,,,,,,,,,,,,,,,,,,,,,,,,,,,,,,Aircraft X,Flight Deck,Air Carrier,Pilot Flying; Captain,Flight Crew Air Transport Pilot (ATP); Flight Crew Instrument; Flight Crew Multiengine,,,Workload; Time Pressure; Communication Breakdown; Situational Awareness,Party1 Flight Crew; Party2 Flight Crew,,1936552,Aircraft X,Flight Deck,Air Carrier,First Officer; Pilot Not Flying,Flight Crew Multiengine; Flight Crew Instrument; Flight Crew Air Transport Pilot (ATP),,,Time Pressure; Workload; Situational Awareness; Physiological - Other; Other / Unknown; Communication Breakdown,Party1 Flight Crew; Party2 Flight Crew,,1936556,Deviation - Altitude Overshoot; Deviation / Discrepancy - Procedural Published Material / Policy; Inflight Event / Encounter Unstabilized Approach; Inflight Event / Encounter CFTT / CFIT,,N,Automation Aircraft Terrain Warning; Person Flight Crew,In-flight,Flight Crew FLC complied w / Automation / Advisory; Flight Crew Executed Go Around / Missed Approach,Environment - Non Weather Related; Airspace Structure; Human Factors; Procedure,Human Factors,"On an approach into ZZZ we were expecting Runway X. When we were about 10 miles out we started getting vectors and Approach Controller notified us that they were switching to Runway XX. By the time we got the new weather and loaded and briefed the approach; we were on right downwind for Runway XX. The main reason why I decided to do a visual approach is that the circling minimums for ILS Runway X would've taken us down to 6300 ft. which is 1000 ft. about above field elevation. For CAT D; the circling radius for us was only 4 NM. The terrain was about 7000 ft. We stayed high; 7500 ft.; due to terrain on final and kept the downwind/base narrower than usual to keep clear of terrain. When turning a 3-4 mile base we got 'caution terrain.' We could still see the terrain and kept visual separation from it and turned final. Because we stayed high on the approach we were too high and therefore we performed a go-around. We decided to go to Runway XY after the go around and landed safely on Runway XY.We were aware of terrains around the airport and both read the company charts information. As a pilot flying; I felt it'd be safer to stay high on downwind and do a visual approach rather than descending and circling for Runway XX. I felt comfortable to shoot a visual approach because I was very familiar with the airport and we had the terrain in sight at all times.It would be really helpful to have published instrument approach procedures for mountainous airports in our fleet.",,"I was the First Officer (FO) and pilot monitoring on my first flight outside of IOE. We were ferrying a plane into ZZZ. The Captain had been there several times before; so the Captain offered to fly the leg. The ATIS was advertising Runway X so we built and briefed the ILS X IAP. However; when we checked in with approach; the controller stated that they were switching runways to XX and offered us the visual and began vectoring us towards the downwind. We rebuilt the visual approach and briefed XX. And while we had quickly got the new ATIS; built and briefed the new visual approach; including company charts; we inappropriately accepted a visual approach without the stipulation of fully following an IAP ground track being met; as stated in the company charts. However; the Captain flying kept us high due to terrain and kept the downwind and base legs narrower than usual to keep clear of terrain. As we turned base; we got a 'caution terrain' indication. We could still see terrain and maintained visual separation the entire time as we turned final. Because the Captain remained higher and flew a tighter pattern; we were too high on final and chose to execute a go-around. We got re-vectored to Runway XY and landed safely.I believe the causes of this event are multiple. The first being me being a very new and inexperienced FO during my first trip off IOE; flying at night; in an unfamiliar airport terminal area on a very short flight. Secondly; the last minute runway change caused us to be task saturated; leading us to accept a visual approach; when the company charts state that we should've followed the ground track of an IAP. There were no IAPs into the runway in use; which means we would've had to circle to the opposite runway. However; the Captain stated that he/she felt it was safer to remain at a higher altitude; above terrain; getting vectored in the pattern and conduct a visual approach than it would be descending down to circling minimums and circling to Runway XX as a visual approach; due to terrain as stated in the company charts. The Captain said he/she felt very comfortable shooting the visual approach higher and off of vectors because he/she was very familiar with the airport; the surrounding terrain; and the fact that we could see the terrain the whole time. And lastly; as a brand new FO; I may have fallen victim to being hesitant to question a crew member with more experience and authority than myself. The Captain was confident in the plan of action. However; looking back; I could've spoken up more in following the company chart stipulation of following an IAP ground track.If I could do this entire arrival over again; I would have taken a couple of moments to slow the sequence of events down. When we received the last minute runway change; we could've asked for radar vectors or enter a holding pattern to create more time for ourselves. We had enough fuel to do so and the weather was VMC. In doing so; we could've reviewed IAP plates and company charts again to determine our best course of action. Also; as a new FO; I should not be hesitant to speak up and contribute to the crew environment; even though I don't have as much experience as the Captain. Also; a suggestion would be to create an RNAV charted visual approach into Runway XX to avoid the need for circling to that runway.",,"CRJ-700 flight crew reported an aircraft generated 'Terrain Warning' while on a night visual approach to an airport in mountainous terrain. The runway assignment was late; the Captain choose to stay high for the terrain that was visible and the Captain was familiar with the airport. The pilots executed a go around and returned to land.",
1936833,202209,0001-0600,ZZZ.Airport,US,,,,,,,,,,,,Tower ZZZ,Air Carrier,EMB ERJ 170/175 ER/LR,,2,Part 121,IFR,Passenger,,Final Approach,,Class B ZZZ,,,,,,,,,,,,,,,,,,,,,,,,,,,,,,,,,,,,,,,,,,,,,,,,,,,,,,,,,,,,,,,Aircraft X,Flight Deck,Air Carrier,Pilot Not Flying; Captain,Flight Crew Multiengine; Flight Crew Instrument; Flight Crew Air Transport Pilot (ATP),,,Confusion; Situational Awareness,,,1936833,,,,,,,,,,,,Deviation / Discrepancy - Procedural Published Material / Policy; Deviation / Discrepancy - Procedural Clearance; Inflight Event / Encounter CFTT / CFIT; Inflight Event / Encounter Unstabilized Approach,,,Automation Air Traffic Control; Person Flight Crew; Person Air Traffic Control,In-flight,Air Traffic Control Issued Advisory / Alert; Flight Crew Returned To Clearance; Flight Crew FLC complied w / Automation / Advisory,Human Factors; Procedure,Human Factors,"We were cleared for the FMS visual approach; we were following the RNAV glide path and realized when we saw the PAPI we were 4 red. We started to correct and got the low altitude alert from ATC; I responded with our call sign and 'correcting'; we got back on glide path quickly and followed the PAPI for the rest of the approach for a normal landing. Cause: Relying too much on RNAV glide path and the approach path being offset slightly not having a great view of the PAPI lights.Suggestions: Utilize all information on glide path (RNAV; PAPI; and visual sight picture of approach).",,,,"ERJ175 Captain reported on visual approach relying on RNAV guidance resulted in low PAPI indications along with ATC low altitude alert.",
1938266,202209,1201-1800,ZZZ.Airport,US,,,,1000,,VMC,10,,Daylight,10000,,,Personal,Bonanza 36,,2,Part 91,None,Training,,Final Approach,Visual Approach,,,,,,,,,,,,,,,,,,,,,,,,,,,,,,,,,,,,,,,,,,,,,,,,,,,,,,,,,,,,,,,,Aircraft X,Flight Deck,Personal,Pilot Flying; Instructor,Flight Crew Multiengine; Flight Crew Flight Instructor; Flight Crew Instrument,Flight Crew Last 90 Days 110; Flight Crew Total 8450; Flight Crew Type 5500,,Situational Awareness,,,1938266,,,,,,,,,,,,Deviation / Discrepancy - Procedural Published Material / Policy; Inflight Event / Encounter Unstabilized Approach; Inflight Event / Encounter Object; Inflight Event / Encounter CFTT / CFIT; Inflight Event / Encounter Loss Of Aircraft Control,,,Person Flight Crew,In-flight,Aircraft Aircraft Damaged; Flight Crew Took Evasive Action; Flight Crew Returned To Departure Airport; Flight Crew Regained Aircraft Control; Flight Crew Executed Go Around / Missed Approach; Flight Crew Diverted; Flight Crew Landed As Precaution,Airport; Human Factors,Human Factors,"While providing flight training to the companion of my flight client; we descended too low on approach to landing at ZZZ. I was providing instruction to help the companion understand an emergency approach to landing if her companion pilot became incapacitated and she would need to land the aircraft. We began the VFR approach about 6 miles from the runway threshold at approximately 2500 ft. AGL. We established a power setting that yielded an indicated airspeed of 120 kts. and extended the landing gear to begin the descent. Everything was proceeding well on the long straight-in approach to Runway 15 at ZZZ. I pointed out to the companion how we could determine if we were going to reach the runway on this glide path or if we would land beyond the runway or if we would land short of the runway. As we got closer to the runway; I pointed out that our current glide path would result in a landing well beyond the runway; so we reduced the throttle (power) to increase descent rate to the runway. After a few moments; I pointed out that we were now too low on our glide path and would likely land short of the runway. I advised the companion that we would advance the throttle to add power to adjust the glide path and level off until landing was assured on the runway. When we advanced the throttle the engine hesitated for an instant before power was increased. In that instant of hesitation the aircraft impacted the top of a large bush just before the runway threshold. After this impact; we added power and began a climb back to pattern altitude. I assessed the condition of the airplane; found it to be airworthy; and decided to return to the aircraft's home base; ZZZ1.Upon landing; we inspected the airplane; and found a minor dent in the leading edge of the Right Wing as well as remnant foliage from the bush on the landing gear. There was no damage to the engine; propeller; or other parts of the airplane.",,,,"BE36 Flight Instructor reported contact with obstacle during final approach.",
