1840953,202109,0601-1200,ZZZ.ARTCC,US,,4,,6000,,Marginal,Haze / Smoke; 3,,Daylight,,,Center ZZZ,Air Taxi,Citationjet (C525/C526) - CJ I / II / III / IV,,2,Part 135,IFR,Ferry / Re-Positioning,,Final Approach,Visual Approach,Class E ZZZ,,,,,,,,,,,,,,,,,,,,,,,,,,,,,,,,,,,,,,,,,,,,,,,,,,,,,,,,,,,,,,,Aircraft X,Flight Deck,Air Taxi,Pilot Flying; First Officer,Flight Crew Instrument; Flight Crew Multiengine; Flight Crew Air Transport Pilot (ATP),Flight Crew Last 90 Days 200; Flight Crew Total 8000; Flight Crew Type 1500,,Fatigue; Situational Awareness,,,1840953,,,,,,,,,,,,Deviation - Altitude Excursion From Assigned Altitude; Deviation / Discrepancy - Procedural Published Material / Policy; Deviation / Discrepancy - Procedural Clearance; Inflight Event / Encounter CFTT / CFIT; Inflight Event / Encounter Unstabilized Approach,,,Automation Aircraft Terrain Warning,In-flight,Flight Crew Returned To Clearance; Flight Crew Became Reoriented,Human Factors,Human Factors,"I was the pilot flying on this empty leg; Part 135 repositioning flight to ZZZ.  I was flying with a XX-year Part 121 pilot who was a recent upgrade and very new to Part 135 flying.  We were on our second week-long rotation together and had been working exceptionally well together on all our previous flights.  Because I had been to ZZZ before; i was pointing out all the important details of the area and what I knew of the airport and local ops prior to descending for the approach.  On this morning; we arrived over the ZZZ area to find a thick morning fog/haze layer over the entire area.  We were in hopes of visually acquiring the airport and making a visual approach; but were unable to see the airport until just before passing overhead; so we elected to shoot the RNAV (GPS) XX.  We had been cleared down to 10;000 feet or 11;000 feet before requesting the RNAV approach; but were instructed to climb and maintain 12;000 feet for the approach.  We were kept at 12;000 feet until crossing ZZZZZ intersection (the IAF).  Twelve thousand feet was significantly higher than the 10;600 feet the procedure calls for prior to ZZZZZ (from that direction) and the 7;500 foot minimum on the leg immediately to follow.  The MSA in the area is 12;400 feet; however.  We initiated a 2;000 FPM descent from 12;000 feet to get established.  I believe we crossed ZZZZZ1 at (or near) the published 7;500 feet. Because we picked up the field visually when crossing overhead and I knew the area (once established inbound) was flat and free of obstructions; coupled with the relatively good visibility near ZZZZZ2 intersection (GS intercept at 6;800 feet); I suppose I transitioned (erroneously) into a 'visual approach; backed up with the RNAV' mentality and; as a result; continued the steeper descent beyond ZZZZZ2 and wound up at least 500 feet low.  I believe the early morning hour; featureless terrain; relatively good (though reduced) visibility and knowledge that the mountainous areas were now behind us lulled me into a more relaxed; visual approach mindset.  The PM was heads-down and neither of us recognized how low we really were until we got an altitude alert from the aircraft.  At that point; I leveled off; recognized the fact we were just under 1;000 feet AGL at approximately 4 NM from the field climbed to correct the deficiency and elected to continue the approach; as we were now re-established with the field clearly in sight.  We immediately called the field and continued visually.  We waited until we were parked at the FBO before debriefing the flight.",,,,"Air Taxi First Officer reported not recognizing they had descended below final approach altitude. The flight crew returned to the correct altitude and continued to landing.",
1841459,202109,,IAH.Airport,TX,,,0,,,VMC,,,,,,Tower IAH,Air Carrier,Large Transport,,2,Part 121,IFR,Passenger,,Landing,,,,,,,,,,,,,,,,,,,,,,,,,,,,,,Tower IAH,,Commercial Fixed Wing,,,,,,,Takeoff / Launch,,,,,,,,,,,,,,,,,,,,,,,,,,Aircraft X,Flight Deck,Air Carrier,First Officer; Pilot Not Flying,Flight Crew Air Transport Pilot (ATP),Flight Crew Last 90 Days 12; Flight Crew Total 1431; Flight Crew Type 1431,,,,,1841459,,,,,,,,,,,,Ground Event / Encounter Jet Blast; Inflight Event / Encounter Loss Of Aircraft Control; Inflight Event / Encounter Unstabilized Approach,,,,In-flight,Flight Crew Regained Aircraft Control,Procedure,Procedure,"IAH was landing in an east flow configuration while departing Runways 15L and 9. We were vectored for an approach in VMC conditions to runway 8R. The approach was straight forward as the winds were rather consistent meaning no gusts encountered the entire way down the approach. The aircraft was stable and configured properly and accordingly with what seemed like very little input needed from the PF to maintain the approach profile both laterally and vertically. We approached the runway and I noticed an aircraft beginning the takeoff roll on 15L and did not think anything of it. In the round-out to flare; the airplane abruptly rolled left while being pushed to the left of the centerline of the runway and then had the nose yaw to the right at about 30-50 feet RA according to the callouts I recall hearing. This also coincided with the Runway 15L threshold passing behind my right shoulder as I recall. The PF made some quick and precise control inputs to get the aircraft back over the centerline wings level and landed while still in the TDZ. As soon as the airplane was slowing and tracking the centerline the PF made a comment/question wondering what the heck happened. I stated that I had an idea; but would wait until we cleared the runway to continue the conversation. After clearing I stated to the Captain I thought we might have encountered a jet blast event due to the surface winds and the aircraft departing on 15L. I was unsure what the aircraft type was that departed 15L as from the cursory glance I gave it on final it did not look like a widebody; so again I did not even think that we might be setting ourselves up for a jet blast encounter. That being said; this was the end of our second leg in this very jet and it had performed flawlessly both flights; so I do not think that there was any malfunction that could be associated with this event.",,,,"Air carrier First Officer reported a possible jet blast encounter during landing flare at IAH airport.  First officer stated they were landing on Runway 8R and the jet blast was from an aircraft taking off on Runway 15L.",
1841555,202109,0601-1200,ZZZ.Airport,US,,,,,,VMC,,,,,,CTAF ZZZ,Air Carrier,Commercial Fixed Wing,,2,Part 121,IFR,Passenger,FMS Or FMC; GPS,Initial Approach,,Class E ZZZ,,,,,,,,,,,,,,,,,,,,,,,,,,,,CTAF ZZZ,Air Carrier,Commercial Fixed Wing,,2,Part 121,IFR,Passenger,,Initial Approach,,Class E ZZZ,,,,,,,,,,,,,,,,,,,,,,,,Aircraft X,Flight Deck,Air Carrier,First Officer,Flight Crew Instrument; Flight Crew Multiengine; Flight Crew Air Transport Pilot (ATP),,,Communication Breakdown; Confusion; Situational Awareness,Party1 Flight Crew; Party2 Flight Crew,,1841555,,,,,,,,,,,,Deviation / Discrepancy - Procedural Published Material / Policy; Inflight Event / Encounter Weather / Turbulence; Inflight Event / Encounter CFTT / CFIT; Inflight Event / Encounter Unstabilized Approach,,,,,Flight Crew Executed Go Around / Missed Approach,Human Factors; Weather,Human Factors,"During RNAV (RNP) M approach to ZZZ Runway XX; the crew of Aircraft X was made aware of company traffic (Aircraft Y) approaching ZZZ with a similar arrival time; as well as another company aircraft (Aircraft Z) requesting departure clearance. After descending on the approach to an altitude where the crew could remain VMC; the crew cancelled IFR to allow company traffic to obtain a clearance. Aircraft X crew broadcasted their position and FMC predicted landing time; and stated intentions to land Runway XX on CTAF. ZZZ radio advised Aircraft Z that they were released for departure. However; when Aircraft Z did not immediately depart or make a radio call stating intentions; the crew of Aircraft X queried them on the company frequency. Aircraft Z responded that they were not aware of their release; and then again contacted ZZZ radio to confirm.After receiving confirmation of their release; Aircraft Z announced that they were departing Runway YY. At this time there was a lack of clarity where Aircraft Z was on the airfield; and the crew of Aircraft X became uncomfortable with the developing situation. The crew discussed that there may be a need to discontinue the approach; but made one more attempt to communicate with Aircraft Z. Based on the presumed impending missed approach; the PF delayed calling for further configuration; and continued toward Runway XX visually; while the PM broadcasted Aircraft X's position; and attempted to determine Aircraft Y's position on the airfield. Ultimately; the crew initiated a non-standard missed approach with a climbing left turn; and announced on CTAF that they would be holding visually over the water north of ZZZ at 1;500 ft. During the missed approach turn; the crew experienced a GPWS caution for terrain that they visually determined to not be a factor. However; the PF did increase thrust and pitch to clear terrain by a wider margin. During visual holding; the PF maintained aircraft configuration at flaps 5 to allow for lower air speeds and improved maneuvering. While Aircraft X was completing a visual 360 degree turn north of ZZZ; Aircraft Z departed Runway YY with a left turn to the southeast; and Aircraft X announced their position and intention to land Runway XX on CTAF. At this time additional company traffic Aircraft Y broadcasted their position and estimated landing Runway YY within 1 minute of Aircraft X.Due to weather observed moving in southeast of ZZZ; the crew of Aircraft X determined the prudent action would be to make an additional visual holding pattern north of ZZZ to allow Aircraft Y to land; as opposed to flying a VFR downwind to Runway YY. To ensure Aircraft Y would have enough time to clear and that both aircraft would not be on approach from opposite directions at the same time; the PF of Aircraft X elected to enlarge the visual holding pattern to the north. Again; Aircraft X crew announced their position and intentions on CTAF. During the visual maneuver; the crew received another GPWS caution for terrain north of them and initiated a turn to the west. Visibility and cloud clearances were excellent in the area and the crew had all terrain well in sight. After Aircraft Y landed and while Aircraft X was maneuvering for a visual approach to Runway XX with raw ILS data tuned and monitored in the background; the crew observed that a cloud had blown in from the south across the final approach path to Runway XX; requiring the PF to fly below the glide path to maintain VMC. During this approach on short final; while on visual and ILS centerline but below glide path at approximately 800 feet; the crew received a glide slope alert which was silenced; and a persistent GPWS caution annunciation. Again; the aircraft was observed to be on centerline and well clear of all terrain; but in an attempt mitigate the GPWS alerts; the PF offset slightly left and continued a descent toward the runway. At approximately 600 feet the crew received a GPWS warning and command of pull up. The crew again observed that they were clear of all obstacles and continued to a landing without further incident.After reviewing the event; the crew determined that they should have initiated a missed approach and turn sooner and at the first indication that opposite direction traffic may become an issue. This would have prevented the crew from descending below 1;000 feet without being fully configured; and may have prevented the first GPWS caution. Although the weather supported holding in VMC; the crew could have requested an IFR clearance to climb to a higher holding altitude and follow traffic into Runway YY.",,,,"Air carrier First Officer reported confusion regarding the location of other company aircraft arriving and departing a non-towered airport. In addition; the reporter stated that a GPWS warning occurred during approach and the flight crew continued to landing after observing they were clear of obstacles.",
1841605,202109,1801-2400,ABQ.TRACON,NM,,,,8000,,,,,,,,TRACON ABQ,Air Carrier,Commercial Fixed Wing,,2,Part 121,IFR,Passenger,FMS Or FMC,Initial Approach,STAR SNDIA FOUR,Class E ZAB,,,,,,,,,,,,,,,,,,,,,,,,GPS & Other Satellite Navigation,,,Failed,,,,,,,,,,,,,,,,,,,,,,,,,,,,,,,,,,,,Aircraft X,Flight Deck,Air Carrier,First Officer; Pilot Not Flying,Flight Crew Multiengine; Flight Crew Air Transport Pilot (ATP); Flight Crew Instrument,,,Troubleshooting; Workload; Confusion; Distraction; Human-Machine Interface; Situational Awareness,,,1841605,,,,,,,,,,,,Aircraft Equipment Problem Less Severe; Deviation - Track / Heading All Types; Deviation / Discrepancy - Procedural Clearance; Ground Event / Encounter Ground Equipment Issue; Inflight Event / Encounter Unstabilized Approach,,,Person Flight Crew,In-flight,Air Traffic Control Provided Assistance; Air Traffic Control Issued New Clearance; Flight Crew Became Reoriented; Flight Crew Requested ATC Assistance / Clarification; Flight Crew Executed Go Around / Missed Approach,ATC Equipment / Nav Facility / Buildings; Company Policy,ATC Equipment / Nav Facility / Buildings,"We were descending via the SNDIA 4 for the ILS Runway 8. Passing ASIDE intersection I noticed that my MFD (Multi Function Display) screen when zoomed in didn't exactly match the Captain's side. As we continued down the arrival we received a clearance for the ILS 8 approach. Going through about 8;000 feet both the Captain and I were looking at a very large discrepancy now between our two screens. The autopilot was coupled to the Captain's side so it was still following what we thought was the correct track. I switched to green needles in anticipation for the turn to the localizer off the transition route and now noticed we were flying through the localizer but our FMS still had us at the previous point prior to the turn. Both the Captain and I were unfamiliar with the airport especially at night; so we were planning on flying the full approach. ATC then asked us to report any GPS issues; which I had responded with yes we believe we have lost GPS; looking for vectors.At this time I had gotten visual contact with the runway as well as the Captain who was flying. We both agreed that due to our current location it was best to discontinue the approach and try again. We went around and got vectored around. The second approach had no issues as we got vectors to final off the localizer. It was later found out that the military was jamming the GPS signal. We also received a terrain INOP yellow message displayed on our MFD's for a few minutes but no associated EICAS message. A GPS signal lost was never displayed on either FMS. We do not know how long or how far off course we were on the arrival as it appeared okay on our end; and ended up missing the turn to the localizer as our FMS was telling us we were several miles behind our current position. ATC needs to be aware of potential military GPS jamming so they can provide that information to the pilots. We did not see a NOTAM in ABQ for jamming either. Given it also being night around terrain; ATC should have provided vectors from the beginning and not the RNAV arrival since GPS signal could not be guaranteed.",,,,"An Air Carrier pilot reported GPS jamming caused an unstable approach at night. The reporter stated the jamming was a known issue but they were never advised and ATC vectored them to an RNAV Approach.",
1842075,202109,,DEN.Airport,CO,,,,,,VMC,,,,,,Tower DEN,Air Carrier,Commercial Fixed Wing,,2,Part 121,IFR,Passenger,Localizer/Glideslope/ILS Runway 16R,Final Approach,,Class B DEN,,,,,,,,,,,,,,,,,,,,,,,,,,,,Tower DEN,Air Carrier,Commercial Fixed Wing,,2,Part 121,IFR,Passenger,,Final Approach,,Class B DEN,,,,,,,,,,,,,,,,,,,,,,,,Aircraft X,Flight Deck,Air Carrier,Pilot Not Flying; First Officer,Flight Crew Air Transport Pilot (ATP); Flight Crew Multiengine; Flight Crew Instrument,Flight Crew Last 90 Days 196.87; Flight Crew Total 1618.17; Flight Crew Type 1618.17,,Situational Awareness; Distraction,,,1842075,Aircraft X,Flight Deck,Air Carrier,Pilot Flying; Captain,Flight Crew Instrument; Flight Crew Multiengine; Flight Crew Air Transport Pilot (ATP),Flight Crew Last 90 Days 206.5; Flight Crew Total 278.77; Flight Crew Type 278.77,,,,,1842086,Conflict Airborne Conflict; Inflight Event / Encounter CFTT / CFIT; Inflight Event / Encounter Unstabilized Approach,,,Automation Aircraft RA,In-flight,Flight Crew Returned To Clearance; Flight Crew Took Evasive Action,Human Factors; Procedure,Human Factors,"We were on final on 16R coming into Denver. As we intercepted the course and set flaps to 5 we received a TCAS RA to descend. We could see Aircraft Y lining up for 16L to our upper left. The RA indicated that we descend. The CA began to lower the nose in accordance with the RA. Aircraft X did not go away even though we complied with its guidance. Naturally we became distracted with the RA and soon realized we were low on the glideslope. We simultaneously realized we were low just as the glideslope warning sounded. We observed 4 red lights on the PAPI. Fortunately the RA stopped. We were able to level; configure and complete a stabilized approach and landing.",,"On final approach into Denver on Runway 16R - another aircraft was on the parrallel approach to 16L.  This aircraft was above us and descending.  We followed the TCAS RA instructions to descend and notified Tower Control of the RA.  TCAS RA ended and the we landed without further issues.",,"Air carrier flight crew reported they received a TCAS RA caused by an aircraft landing on the parallel runway during final approach to Runway 16R at DEN airport.  The crew responded to the RA; but descended too low and received a glideslope warning. Once the RA was resolved; the crew were able to stabilize the aircraft and continued their approach and landing.",
1843019,202109,1201-1800,ZZZ.Airport,US,,0,0,,,VMC,10,,Daylight,,,,FBO,Cessna Aircraft Undifferentiated or Other Model,,1,Part 91,VFR,Training,,Landing,Visual Approach,Class D ZZZ,,,,,,,,,,,,,,,,,,,,,,,,,,,,,,,,,,,,,,,,,,,,,,,,,,,,,,,,,,,,,,,Aircraft X,Flight Deck,Personal,Pilot Flying; Single Pilot,Flight Crew Private,Flight Crew Last 90 Days 1.2; Flight Crew Total 150; Flight Crew Type 1.2,,Situational Awareness; Training / Qualification; Confusion,,,1843019,,,,,,,,,,,,Deviation / Discrepancy - Procedural Published Material / Policy; Ground Event / Encounter Ground Strike - Aircraft; Inflight Event / Encounter Loss Of Aircraft Control; Inflight Event / Encounter Unstabilized Approach,,,Person Flight Crew,In-flight,,Human Factors,Human Factors,"I haven't flown in years and just got back in an aircraft with a Flight Instructor. I didn't add sufficient power when realizing I was low on the glide-slope and this led to touching down short of the displaced runway threshold. This can be avoided in the future by aiming for the numbers; pitching for approach speed and using power to control the rate of descent.",,,,"Pilot reported they were below the glide slope and did not correct in time to prevent landing short of the runway threshold.",
1843337,202110,1201-1800,ZZZ.Tower,US,,,,1500,,VMC,,,,,,Tower ZZZ,Air Carrier,Commercial Fixed Wing,,2,Part 121,IFR,Passenger,,Final Approach,Visual Approach,Class B ZZZ,,,,,,,,,,,,,,,,,,,,,,,,,,,,,,,,,,,,,,,,,,,,,,,,,,,,,,,,,,,,,,,Aircraft X,Flight Deck,Air Carrier,Pilot Flying; Captain,Flight Crew Multiengine; Flight Crew Air Transport Pilot (ATP); Flight Crew Instrument,Flight Crew Last 90 Days 177; Flight Crew Total 1148; Flight Crew Type 1148,,Distraction; Human-Machine Interface,,,1843337,Aircraft X,Flight Deck,Air Carrier,First Officer; Pilot Not Flying,Flight Crew Multiengine; Flight Crew Instrument; Flight Crew Air Transport Pilot (ATP),Flight Crew Last 90 Days 192; Flight Crew Total 2748; Flight Crew Type 2748,,Distraction; Human-Machine Interface,,,1843712,Deviation - Altitude Excursion From Assigned Altitude; Deviation - Speed All Types; Deviation / Discrepancy - Procedural Clearance; Deviation / Discrepancy - Procedural Published Material / Policy; Inflight Event / Encounter CFTT / CFIT; Inflight Event / Encounter Unstabilized Approach,,,Person Air Traffic Control; Person Flight Crew,In-flight,Flight Crew Overcame Equipment Problem,Human Factors,Human Factors,"We were cleared to 2000 ft. on the lateral path of Runway XX. I was at 210 kts. and in level change descending to 2000 ft. We called the runway and were cleared visual approach for Runway XX around ZZZZZ. I thought VNAV was engaged and asked for touch down elevation. I did not verify that VNAV was engaged. I asked for flaps 1 and flaps 5 to slow down. I was inadvertently in level change and the aircraft pitched nose down to maintain the 210 kts. I disconnected the autopilot and leveled the aircraft. During the repair; ATC called low altitude alert. We acknowledged that we were correcting and continued the landing normally.",,"Aircraft automation was selected with LNAV and level change while descending to 2000 ft. Subsequently cleared visual approach and PF (Pilot Flying) started configuring to slow and asked to set touchdown elevation in the altitude window. PF and PM (Pilot Monitoring) didn't verify appropriate vertical mode for phase of flight and aircraft pitched for speed on pitch descent below glidepath. PF disconnected automation and corrected while PM communicated altitude correction to Tower.",,"Air Carrier flight crew reported receiving ATC low altitude alert during visual approach. Excursion from altitude was due to flight crew failure to verify vertical VNAV mode selected.",
1843370,202110,1801-2400,ZZZ.Tower,US,,,,,,IMC,,,,,,Tower ZZZ,Air Carrier,Commercial Fixed Wing,,2,Part 121,IFR,Passenger,,Initial Approach,,Class D ZZZ,,,,,,,,,,,,,,,,,,,,,,,,,,,,,,,,,,,,,,,,,,,,,,,,,,,,,,,,,,,,,,,Aircraft X,Flight Deck,Air Carrier,Pilot Not Flying; Captain,Flight Crew Multiengine; Flight Crew Instrument; Flight Crew Air Transport Pilot (ATP),,,Human-Machine Interface; Workload; Distraction,,,1843370,,,,,,,,,,,,Deviation - Altitude Excursion From Assigned Altitude; Deviation / Discrepancy - Procedural Published Material / Policy; Deviation / Discrepancy - Procedural Clearance; Inflight Event / Encounter Weather / Turbulence; Inflight Event / Encounter Unstabilized Approach; Inflight Event / Encounter CFTT / CFIT,,,Person Air Traffic Control; Person Flight Crew,In-flight,Flight Crew Overcame Equipment Problem,Human Factors,Human Factors,"While coming into ZZZ we checked the weather and the ceilings were not quite what we needed for the RNAV XX. We had plenty of gas and decided to ask for a hold. After holding we were informed of an aircraft that had broken out right at minimums. We decided to start the approach. We were cleared to cross the Initial Approach Fix at or above 3;000 ft. After crossing the fix the FO (First Officer) pilot flying; set the new altitude for 2;100 ft. which was the lowest altitude on the segment for the final app fix. After leveling off the First Officer then set 800 ft. for the MDA. Prior to the FAF I suggested flaps 45 instead of flaps 22 so we could get a lower deck angle and see the field better. He agreed so I was heads down while getting the new numbers. I was also told to contact Tower and after checking on he mentioned to check our altitude because he saw us low. At that point the FO was already correcting and we returned to the previous altitude promptly. This was corrected before the FAF so we didn't see a reason to terminate the approach. Not properly monitoring and heads down in a critical phase of flight. I shouldn't have suggested the late flap change. If I hadn't I could have noticed the FO descending early before ATC did. Next time I will keep what we have and after a missed approach I could change and try again.",,,,"Air carrier Captain reported altitude excursion during initial approach due to his failure to properly monitor flying pilot. Altitude excursion was corrected and flight completed a safe landing.",
1843411,202110,1201-1800,ZZZ.Airport,US,,,,1300,,,,,Daylight,,,,Air Carrier,Regional Jet 200 ER/LR (CRJ200),,,Part 121,,Passenger,,Initial Approach,Visual Approach,Class E ZZZ; Class G ZZZ,,,,,,,,,,,,,,,,,,,,,,,,,,,,,,,,,,,,,,,,,,,,,,,,,,,,,,,,,,,,,,,Aircraft X,Flight Deck,Air Carrier,Pilot Flying,Flight Crew Multiengine; Flight Crew Air Transport Pilot (ATP); Flight Crew Instrument,,,Situational Awareness,,,1843411,,,,,,,,,,,,Inflight Event / Encounter Unstabilized Approach; Inflight Event / Encounter CFTT / CFIT,,,Automation Aircraft Terrain Warning,In-flight,Flight Crew FLC complied w / Automation / Advisory; Flight Crew Became Reoriented,Environment - Non Weather Related; Human Factors,Ambiguous,"Approaching ZZZ airport for Runway XX for a visual approach with the PAPI light out of service; there is a hill and the runway has a uprising slope. At 1;300 ft. AGL the system detected that we were at 1;000 ft. due to the terrain just before the airport when in reality we were 1;300 ft. I adjusted the rate of descent just over 1;000 ft to be stabilized for the approach. The aircraft EGPWS announced terrain terrain pull up; so I adjusted by vertical descent to 800 FPM then proceeded to land on a stabilize approach. Adjusting vertical rate of descent close to the airport with the uprising hill near the approach end of Runway XX at ZZZ. Being stabilized at 2;000 ft. for this approach will help avoiding the terrain occurrence.",,,,"CRJ-200 Captain reported getting an EGPWS alert due to the terrain during visual approach. The pilot decreased the rate of descent; stabilized the aircraft; and continued to landing.",
