 ,Time,Time,Place,Place,Place,Place,Place,Place,Place,Environment,Environment,Environment,Environment,Environment,Environment,Aircraft 1,Aircraft 1,Aircraft 1,Aircraft 1,Aircraft 1,Aircraft 1,Aircraft 1,Aircraft 1,Aircraft 1,Aircraft 1,Aircraft 1,Aircraft 1,Aircraft 1,Aircraft 1,Aircraft 1,Aircraft 1,Aircraft 1,Aircraft 1,Aircraft 1,Aircraft 1,Aircraft 1,Aircraft 1,Aircraft 1,Aircraft 1,Aircraft 1,Aircraft 1,Aircraft 1,Aircraft 1,Aircraft 1,Aircraft 1,Aircraft 1,Aircraft 1,Aircraft 1,Aircraft 1,Aircraft 1,Component,Component,Component,Component,Aircraft 2,Aircraft 2,Aircraft 2,Aircraft 2,Aircraft 2,Aircraft 2,Aircraft 2,Aircraft 2,Aircraft 2,Aircraft 2,Aircraft 2,Aircraft 2,Aircraft 2,Aircraft 2,Aircraft 2,Aircraft 2,Aircraft 2,Aircraft 2,Aircraft 2,Aircraft 2,Aircraft 2,Aircraft 2,Aircraft 2,Aircraft 2,Aircraft 2,Aircraft 2,Aircraft 2,Aircraft 2,Aircraft 2,Aircraft 2,Aircraft 2,Aircraft 2,Aircraft 2,Aircraft 2,Aircraft 2,Person 1,Person 1,Person 1,Person 1,Person 1,Person 1,Person 1,Person 1,Person 1,Person 1,Person 1,Person 2,Person 2,Person 2,Person 2,Person 2,Person 2,Person 2,Person 2,Person 2,Person 2,Person 2,Events,Events,Events,Events,Events,Events,Assessments,Assessments,Report 1,Report 1,Report 2,Report 2,Report 1,
ACN,Date,Local Time Of Day,Locale Reference,State Reference,Relative Position.Angle.Radial,Relative Position.Distance.Nautical Miles,Altitude.AGL.Single Value,Altitude.MSL.Single Value,Latitude / Longitude (UAS),Flight Conditions,Weather Elements / Visibility,Work Environment Factor,Light,Ceiling,RVR.Single Value,ATC / Advisory,Aircraft Operator,Make Model Name,Aircraft Zone,Crew Size,Operating Under FAR Part,Flight Plan,Mission,Nav In Use,Flight Phase,Route In Use,Airspace,Maintenance Status.Maintenance Deferred,Maintenance Status.Records Complete,Maintenance Status.Released For Service,Maintenance Status.Required / Correct Doc On Board,Maintenance Status.Maintenance Type,Maintenance Status.Maintenance Items Involved,Cabin Lighting,Number Of Seats.Number,Passengers On Board.Number,Crew Size Flight Attendant.Number Of Crew,Airspace Authorization Provider (UAS),Operating Under Waivers / Exemptions / Authorizations (UAS),Waivers / Exemptions / Authorizations (UAS),Airworthiness Certification (UAS),Weight Category (UAS),Configuration (UAS),Flight Operated As (UAS),Flight Operated with Visual Observer (UAS),Control Mode (UAS),Flying In / Near / Over (UAS),Passenger Capable (UAS),Type (UAS),Number of UAS Being Controlled (UAS),Aircraft Component,Manufacturer,Aircraft Reference,Problem,ATC / Advisory,Aircraft Operator,Make Model Name,Aircraft Zone,Crew Size,Operating Under FAR Part,Flight Plan,Mission,Nav In Use,Flight Phase,Route In Use,Airspace,Maintenance Status.Maintenance Deferred,Maintenance Status.Records Complete,Maintenance Status.Released For Service,Maintenance Status.Required / Correct Doc On Board,Maintenance Status.Maintenance Type,Maintenance Status.Maintenance Items Involved,Cabin Lighting,Number Of Seats.Number,Passengers On Board.Number,Crew Size Flight Attendant.Number Of Crew,Airspace Authorization Provider (UAS),Operating Under Waivers / Exemptions / Authorizations (UAS),Waivers / Exemptions / Authorizations (UAS),Airworthiness Certification (UAS),Weight Category (UAS),Configuration (UAS),Flight Operated As (UAS),Flight Operated with Visual Observer (UAS),Control Mode (UAS),Flying In / Near / Over (UAS),Passenger Capable (UAS),Type (UAS),Number of UAS Being Controlled (UAS),Location Of Person,Location In Aircraft,Reporter Organization,Function,Qualification,Experience,Cabin Activity,Human Factors,Communication Breakdown,UAS Communication Breakdown,ASRS Report Number.Accession Number,Location Of Person,Location In Aircraft,Reporter Organization,Function,Qualification,Experience,Cabin Activity,Human Factors,Communication Breakdown,UAS Communication Breakdown,ASRS Report Number.Accession Number,Anomaly,Miss Distance,Were Passengers Involved In Event,Detector,When Detected,Result,Contributing Factors / Situations,Primary Problem,Narrative,Callback,Narrative,Callback,Synopsis,

1781456,202101,1201-1800,IND.Airport,IN,,,1300,,,VMC,,,,,,TRACON IND; Tower IND,Air Carrier,Commercial Fixed Wing,,2,Part 121,,Passenger,,Initial Approach,,Class C IND; Class E ZID,,,,,,,,,,,,,,,,,,,,,,,,,,,,,,,,,,,,,,,,,,,,,,,,,,,,,,,,,,,,,,,,Flight Deck,Air Carrier,Captain; Pilot Not Flying,Flight Crew Multiengine; Flight Crew Air Transport Pilot (ATP); Flight Crew Instrument,,,Workload; Situational Awareness,,,1781456,,,,,,,,,,,,Deviation - Altitude Overshoot; Deviation / Discrepancy - Procedural Published Material / Policy; Inflight Event / Encounter Unstabilized Approach; Inflight Event / Encounter CFTT / CFIT,,,Person Flight Crew,In-flight,General None Reported / Taken,Human Factors,Human Factors,"Better monitor FO actions. Increase awareness of calculating descent points using distance from the runway to approximate a 3 degree descent path to the runway in order to avoid unnecessary and lengthy low level segments.  Flying at 3;000 feet about 15 miles WSW of IND direct to BIGRD on the RNAV Y 5R. Approach asked if we had the field in sight; we responded that we did; and then we were given a left turn pretty much direct to HUUPS; which is the final approach fix on the RNAV Y 5R; and cleared for the visual approach. Tower then handed us off to Tower. During this time while I was switching to Tower I became task saturated with my PM flying duties from the frequency change; getting a landing clearance; and the FO requesting flap configuration changes. After we were cleared to land I noticed we were just about to level off at 2;100 feet. Well below a 3 degree descent path given our current position to the runway. I had not noticed the FO had set 2;100 feet; which is the altitude at HUUPS; and started a descent as soon as we were cleared for the approach. We leveled off at 2;100 feet and continued for some time before reaching HUUPS and continuing the descent for the runway. We were level at approximately 1;300' feet AGL for a while before descending for landing. I don't think this was technically illegal or in violation of an FAR; as we were cleared for the visual and in the process of making a descent for landing; but I do feel it's not a good technique to simply set the FAF altitude; dive and drive to that altitude; level off for several miles; then continue descent once over the FAF. We were not on a published portion of an approach; and well below a 3 degree descent path to the runway. This wasn't an issue for this particular approach; but it could become an issue at night in mountainous terrain or if there are obstacles in the area.",,,,"Air carrier Captain reported getting too low while on a visual approach to IND airport.",
1781714,202101,0001-0600,ZZZZ.Tower,FO,,,500,,,,,,,,,Tower ZZZZ,,Commercial Fixed Wing,,2,Part 121,IFR,Passenger,,Landing,,,,,,,,,,,,,,,,,,,,,,,,,,,,,,,,,,,,,,,,,,,,,,,,,,,,,,,,,,,,,,,,,Aircraft X,Flight Deck,Air Carrier,Pilot Flying,Flight Crew Air Transport Pilot (ATP); Flight Crew Instrument; Flight Crew Multiengine,,,Communication Breakdown; Distraction; Situational Awareness; Workload,Party1 Flight Crew; Party2 ATC,,1781714,,,,,,,,,,,,ATC Issue All Types; Deviation / Discrepancy - Procedural Published Material / Policy; Ground Event / Encounter Ground Equipment Issue; Inflight Event / Encounter Unstabilized Approach,,,Person Flight Crew,In-flight,General None Reported / Taken,Environment - Non Weather Related; Human Factors,Human Factors,"Inbound to ZZZZ on ZZZZZ Star.  Taken off STAR early and cleared direct to ZZZZ1 VOR.  We were instantly 1;800 feet above the path.  Proactively used speed brakes and planned to slow and extend flaps when below 20;000 feet; but were then told to keep speed at 250 KTS.  Lowered landing gear shortly after passing ZZZZ1 to get back on profile.  Was able to regain the VNAV path just prior to ZZZZZ1 and at Vref +10 per procedure.  Flaps were at 25. Frequency was very busy and sky hazy. Very late hand off to Tower.  Localizer did not correctly ID until just prior to FAF.  FO was very busy with frequency changes; configuration changes and checklist.  Tower did not clear us to land; but instructed us to continue as an aircraft was in position on our Runway; XXR. Another aircraft was holding short of XXR waiting to cross.  At 1;000 feet I was at approach speed and called 'stable;' but was distracted by no landing clearance and aircraft on runway.  Aircraft in position was cleared for immediate takeoff; we were cleared to land; and other aircraft was given clearance to cross XXR.  Departing aircraft was slow to accelerate.  Passing 500 feet FO made 'stable' call.  Shortly after we received an aural alert indicating we did not have landing flaps selected.  Flaps indicator showed flaps at 25 degrees verses the planned and briefed of 30 degrees.  I realized I had not asked for flaps 30 and was now below 400 feet. Elected not to make a configuration change to 30 degrees below 1;000 feet per procedure.  Hesitant to go-around per procedure because I wasn't sure if the crossing aircraft had not just departed the inboard parallel Runway XXL; and the late departing XXR aircraft had just rotated.  With the very hazy sky I was concerned about a conflict and /or overtaking the other aircraft during the go-around to increase speed to Vref+10 and land with flaps 25. Landing and rollout were normal.Despite adequate and recent experience into ZZZZ; these particular controllers were hard to understand.  FO had to ask for clarification a few times in the last 1;500 feet FAF. FO had just returned from 7 months of leave; was called out on reserve; and had only flown once earlier; and 4 times in the last 7 months.  I briefed the arrival and approach thoroughly and early; but it was a Max effort with the direct clearance.  I believe he got distracted from completing the checklist when the localizer did not ID until just before the FAF.  I was distracted from not calling for final flaps with the aircraft on the runway and the hazy conditions; and the late localizer ID.Add to the note of being at Vref +10 by the ZZZZZ1 fix; to be at final landing flaps. This may have helped me if I had a goal to complete that by the fix.",,,,"Air carrier Captain reported an unstable approach and cited it was difficult to understand the controllers at this foreign location.",
1781737,202101,1201-1800,DEN.Airport,CO,,,400,,,VMC,,,,,,TRACON D01; Tower DEN,Air Carrier,Commercial Fixed Wing,,2,Part 121,IFR,Passenger,,Final Approach,STAR CLASH 3,Class B DEN,,,,,,,,,,,,,,,,,,,,,,,,,,,,,,,,,,,,,,,,,,,,,,,,,,,,,,,,,,,,,,,Aircraft X,Flight Deck,Air Carrier,Pilot Flying; Captain,Flight Crew Multiengine; Flight Crew Instrument; Flight Crew Air Transport Pilot (ATP),Flight Crew Last 90 Days 107.42; Flight Crew Total 4116.63; Flight Crew Type 1991.77,,Communication Breakdown; Time Pressure; Workload,Party1 Flight Crew; Party2 Flight Crew,,1781737,Aircraft X,Flight Deck,Air Carrier,First Officer; Pilot Not Flying,Flight Crew Instrument; Flight Crew Air Transport Pilot (ATP); Flight Crew Multiengine,Flight Crew Last 90 Days 90.05; Flight Crew Total 800.35; Flight Crew Type 800.35,,Confusion; Communication Breakdown; Time Pressure; Human-Machine Interface; Workload,Party1 Flight Crew; Party2 ATC,,1782234,ATC Issue All Types; Deviation / Discrepancy - Procedural Published Material / Policy; Inflight Event / Encounter Unstabilized Approach,,,Automation Aircraft Terrain Warning,In-flight,Flight Crew Executed Go Around / Missed Approach,Chart Or Publication; Procedure; Human Factors,Procedure,"In preparation for our arrival into DEN we briefed for the CLASH 3 RNAV arrival and the ILS to 35R as this was the expected runway from our direction of arrival. We also included in our brief the threat in DEN of runway changes and how we'd handle that especially during the descent phase on the arrival. About 20 NM from the waypoint CLASH on the arrival ATC informed us to expect runway 35L. We then re-set up for that runway and re-briefed. There was still plenty of time for this and there was little time compression. One point of confusion; however; was that the CLASH 3 has a transition for RWY 35R; but doesn't for 35L; which only has a point at which to expect vectors. We spent some time studying the arrival and approach plates to ensure that was the case to make sure we weren't missing something. I asked my F/O to double check as he was the PM and I wanted to concentrate on the descent as the PF. This has always been confusing as some arrivals and approaches have transition points and some don't. There should be some consistency. This was the beginning of some of the time compression which would later result in some workload management issues.Some point after this ATC broke us off of the arrival and instructed us to descend to 9000 feet and gave us a heading. They then assigned us to RWY 35R. We related that we'd just been assigned 35L and they reiterated we were now reassigned to 35R. This resulted in a very rushed set up for 35R as we were now pretty close in to the approach environment. I asked the F/O to set it all up so that I could continue to fly. I quickly dialed in what I thought was the 35R LOC; but it turned out not to be. I could see that he was struggling and tried to help him out. In hindsight; this was a mistake in workload management because I should have let the F/O do all of the set up. I verbalized that we didn't need to re-brief for 35R as we'd already briefed it and so had a plan. Again; in hindsight; I'm not sure this was a correct call; but we literally did not have time to brief at that point.Shortly after this we were cleared the visual approach to 35R.  We were roughly 7 miles from FRONZ and discussed not descending too quickly so as not to bust the floor of the Class B airspace. At about the same time ATC asked us to slow to approach speed for traffic ahead of us for 35R. After slowing we ended up just about 2.5 miles in trail.  At this point we were apprised of traffic for 35L and received a TCAS TA because of the assigned heading we were given to intercept the LOC for 35R. We both saw the traffic and I decided to hand fly from this point on as we had an overshooting crosswind and given our heading there would have been a good chance of an overshoot of the LOC.At FRONZ I asked for gear down and flaps 15. At about this point I noticed that neither the LOC or GS were engaging but I had the runway and the PAPI and decided to continue as we had been cleared for the visual. The FO asked if I'd like him to try and dial in the correct LOC and I said yes if he had the bandwidth to do so. Soon after we passed through 1;000 feet and we both missed the call out as I think he was still trying to dial in the LOC frequency. Also we never accomplished the Landing Checklist as we never got to final flaps. We got to 500 feet and we made those call outs. At around 400 feet AFL we received a Too Low Flaps GPWS warning and my knee jerk reaction was to call for FLAP 30 once I realized we were still at FLAPS 15. I don't know if the FO ever selected them; however. I quickly realize this was the wrong call and called for us to go around and the FO called for it at about the same time. We executed the missed approach with no issues and were vectored expeditiously for a second approach and landing without further incident.The FO is not submitting a report as far as I'm aware as we had no ATC deviations or non-compliance with FARS.",,"This is a report regarding Flight X ZZZ-DEN regarding the changes and ATC clearances we received during our descent and approach to land in DEN.When we reviewed the flight plan in ZZZ we loaded the CLASH3 STAR with runway 35R being our selected landing runway. The flight plan had 17R; but DEN was landing North so that was the only change made to the plan on our part versus what dispatch had planned.Prior to TOD the CA fully reviewed and briefed the STAR and approach that we were expecting. We were fully prepared to execute this plan. Upon checking in with a close in DEN center controller we were advised to expect runway 35L with the EBBLR transition. There was some discussion regarding the EBBLR transition by myself and the CA as we were attempting to figure out if the transition and how the transition linked up with the approach. However; we did this again prior to TOD and were able to be prepared for the new arrival transition and approach. As we descended into Denver; we were handed off to DEN APP. This controller changed our runway back to 35R. We were well into the descent at this point and fairly close to the airport. The CA instructed me to load up the new approach and as I was attempting to do so ATC took us off the arrival for vectors and speed changes. At this point we were South of DEN but still fairly close in. I was still working on getting the FMC setup when ATC vectored us due West and then turned us on to final for 35R. The vector was vey poorly planned by the controller and both the CA and I could see that we were going to blow through the localizer if we allowed the A/P to handle the intercept. The CA disengaged the A/P and made a manual turn to join the localizer. At this point we could both see that the vector had us close in behind another airplane in final. ATC requested that we slow to 160 knots. The CA asked for me to deploy the gear and the flaps to down and 15. Shortly after ATC then requested us to slow to the slowest possible speed. Both the CA and I were closely monitoring the separation between us and the preceding aircraft. At this point I noticed there was a message on the FMC scratchpad that I had not seen before and did not recognize. I don't remember exactly what the message was but it did indicate that there was a conflict between the FMC selected approach and what the VHF radios were tuned to. I was rapidly trying to get the correct frequency on the NAV radios but my JEPP app on the iPad was not responding quickly as I was attempting to zoom in to view the frequency box. At this point we were somewhere around 1;000 feet AGL. The CA announced that he had the runway and the PAPIs in sight and was going to land and just disregard the FMC He was busy attempting to slow and again we were both concerned about the separation between us the preceding aircraft. That was what are focus was on at this point. I cannot recall if either the 1;000 ft or the 500 ft call outs were made. We were both totally task saturated at this time. At some altitude below 500 ft we received a warning message 'too low-flaps'. We both looked at the flap position and realized we were still at flaps 15. The CA called for flaps 30 and I monetarily selected flaps 30 before advocating that we needed to go around. The CA also realized we had to go around at almost the same instant I was stating that we needed to go around. So we executed the go around. We did have the 10;000 ft foot missed approach altitude selected in the MCP so we were climbing to that altitude. However; while just climbing through 7;000 the tower told us to maintain 7;000. I advised tower that we were at 7;200. Tower instructed us to maintain 7;100. We descended back to 7;100 feet and flew runway heading and completed the rest of the go around profile. Tower asked us for the reason for the GA and I replied 'configuration'. They handed us off to approach and we were vectored back around for another ILS to runway 35R. We ensured everything was properly setup and landed without further incident.Some comments about this incident. Both the CA and I had discussed the threat of Denver and how they often make changes to arrivals and approaches during cruise. In fact the CA had been reading in the flight ops newsletter on his iPad about the problems we have been having with arrivals into Denver. We were both fully aware that Denver presented a threat and thought that we had planned and were prepared for our arrival. Had we been cleared as planned per our original plan we would have been fine. Even after the first change to runway 35L we had time to plan and brief. It was only after the final switch back to 35R that we both began to become task saturated with the speed changes; the off route vectors; the FMC programming; the NAV radios; the poor vector to join final; and finally the separation between us and the preceding aircraft and the speed changes made while on final in regards to that aircraft. The amount of items needed to be accomplished while this was occurring in the terminal area was long and complex. We both became so overcome that we must have failed to accomplish the landing checklist; which would have had both of us realizing that we were not in the landing configuration.We made errors along the way; failing to get some of the call outs accomplished; FMC programming; and NAV radio frequency selection among some of the errors. However; many of these errors were driven by the nature of the changes being made by ATC in regards to arrival vectors; speed changes; runway and approach changes among other demands being made by ATC in a very time compressed period while flying within (or near) the terminal area.One more note about the runway changes in Denver. I know Denver and am aware of its threat even on departure. So while we were getting ready to depart and head to ZZZ2 I asked the ramp controller which runway was in use for the ZZZZZ SID. He stated XXR. Yet; when we received our push clearance 15-20 minutes later he told us to expect runway XY. I don't know if he was given bad information by the ATC tower or what happened; but yet again here we are in a high workload situation having to make changes to the FMC and request new TO data.Because of our short turn time in Denver the CA decided to debrief the entire arrival event into Denver while in cruise flying back to ZZZ2. We spent a good 30-40 minutes discussing the flight. Threat and errors were discussed; we used the briefing cards and identified what had occurred on the flight. I am not going to make excuses for the errors that we made; even if they occurred during a task saturated situation. However; a couple of my observations from this event were that we had talked about Denver ATC being a threat. We thought that we had addressed this threat by a good solid brief for the originally planned arrival; even after the change to the 35L arrival; we had time to plan and brief. We were ready; but ATC in Denver threw us some many changes and curve balls that we both were task saturated to the point leading to an undesired aircraft state. Fortunately; both the CA and I followed our training and SOP. safely executed a missed approach; and subsequently landed safely and uneventfully on the next approach.",,"Air carrier flight crew reported a high workload environment on approach into DEN airport; which included several runway changes; confusion over arrival procedures; and an unstable approach resulted in a go-around.",
