1798694,202104,1201-1800,ZZZ.Airport,US,,,,,,,,,,,,TRACON ZZZ,Air Carrier,A319,,2,Part 121,IFR,Passenger,FMS Or FMC; GPS,Initial Approach,Direct,Class E ZZZ,,,,,,,,,,,,,,,,,,,,,,,,,,,,,,,,,,,,,,,,,,,,,,,,,,,,,,,,,,,,,,,Aircraft X,Flight Deck,Air Carrier,First Officer; Pilot Not Flying,Flight Crew Instrument; Flight Crew Air Transport Pilot (ATP); Flight Crew Multiengine,,,Workload; Communication Breakdown; Situational Awareness,Party1 Flight Crew; Party2 Flight Crew,,1798694,,,,,,,,,,,,Deviation - Speed All Types; Deviation / Discrepancy - Procedural Published Material / Policy; Inflight Event / Encounter CFTT / CFIT; Inflight Event / Encounter Unstabilized Approach; Inflight Event / Encounter Weather / Turbulence,,,Automation Aircraft Terrain Warning; Person Flight Crew,In-flight,Flight Crew FLC complied w / Automation / Advisory; Flight Crew Executed Go Around / Missed Approach; Flight Crew Became Reoriented,Human Factors; Weather,Human Factors,"Neither one of us had ever been into ZZZ. We both took the opportunity on the flight to review the company pages. Acknowledging that it is a special qualification airport and after review of company documents; we realized that controls needed to be transferred to the Captain due to my low time in the aircraft. Control of the aircraft was transferred at approximately 13;000 feet MSL. Traffic was landing XXL. We briefed and set up for the RNAV for XXL. Center handed us off to ZZZ Approach. We were asked to advise when the field was in sight. Conditions were VFR and remained so. We had the field and were cleared for the visual. We recognized immediately that we were high. We had a tailwind which made it exceptionally difficult to get configured. The Captain continued to descend and try to reduce speed. He called for gear; however; I was unable to extend the gear because we were not at the appropriate speed. We were switched to Tower. The Captain continued the descent all the while attempting to reduce speed. Best guess we were at approximately a 7 mile final. We received an EGPWS 'TERRAIN TERRAIN'. The Captain shallowed the descent. It was then followed by a 'TERRAIN TERRAIN PULL UP' and I called for the go-around. We followed the escape procedures; were vectored around the pattern; and landed without incident. Neither pilot had been into the airport. We had reviewed documents; however once cleared for the visual we did not comply with the prescribed speeds on the arrival. In retrospect; we should have continued on the RNAV arrival since we were unfamiliar with the airport. Additionally; better awareness of wind may have assisted in getting configured.",,,,"A319 First Officer reported aircraft generated CFIT Warning while on approach.",
1798937,202104,0001-0600,RNO.Airport,NV,,,,,,,,,,,,Tower RNO,Air Carrier,Commercial Fixed Wing,,2,Part 121,IFR,Passenger,FMS Or FMC; GPS,Initial Approach,,Class C RNO,,,,,,,,,,,,,,,,,,,,,,,,,,,,,,,,,,,,,,,,,,,,,,,,,,,,,,,,,,,,,,,Aircraft X,Flight Deck,Air Carrier,Captain; Pilot Flying,Flight Crew Instrument; Flight Crew Multiengine; Flight Crew Air Transport Pilot (ATP),,,Situational Awareness,,,1798937,,,,,,,,,,,,Deviation - Speed All Types; Inflight Event / Encounter CFTT / CFIT; Inflight Event / Encounter Unstabilized Approach,,,Automation Aircraft Terrain Warning; Person Flight Crew,In-flight,Air Traffic Control Issued New Clearance; Flight Crew Executed Go Around / Missed Approach,Human Factors,Human Factors,"Runway 16L; the controls were transferred to me by my First Officer (FO).Oakland Center handed us off to Reno Approach; on initial contact we were advised to report the field insight for the visual approach to 16L. After calling the field in sight; I realized that we were a bit high and closer to the field than I had anticipated. Calling for gear down; my first officer called 'speed check" I realized that with speed brakes extended; and all efforts to slow the airplane; with a quartering tailwind; my efforts were futile. Still descending and approaching position WORTH on the RNAV approach we were handed over to tower who cleared us for landing on Runway 16L. Being unstabilized at this time and receiving an EGPWS 'TERRAIN TERRAIN' followed by 'PULL UP" my FO and I simultaneously announced "GO AROUND.'We executed the EGPWS escape maneuver and were vectored for another visual approach; followed by an uneventful landing to Runway 16L. Never having flown into the RNO airport; having an FO just off OE (operator experience) and new to the aircraft type; gusty winds; tailwind on initial descent and approach. On landing winds were 260/variable. On arrival at the gate we were told by station personnel other aircraft had also gone around a one diverted. Suggest more emphasis on speed control throughout the descent and approach.",,,,"Air carrier Captain reported receiving a EGPWS terrain warning on approach into Reno airport.",
1799610,202104,1801-2400,LCH.Airport,LA,,,,,,,,,,,,TRACON LCH,Air Carrier,Commercial Fixed Wing,,2,Part 121,IFR,Passenger,,Initial Approach,,Class D LCH,,,,,,,,,,,,,,,,,,,,,,,,,,,,,,,,,,,,,,,,,,,,,,,,,,,,,,,,,,,,,,,Aircraft X,,Air Carrier,Pilot Not Flying; Captain,Flight Crew Multiengine; Flight Crew Air Transport Pilot (ATP); Flight Crew Instrument,,,Distraction; Workload; Troubleshooting,,,1799610,,,,,,,,,,,,Ground Event / Encounter Ground Equipment Issue; Inflight Event / Encounter Unstabilized Approach; Inflight Event / Encounter Weather / Turbulence,,,Automation Aircraft Other Automation; Person Flight Crew,In-flight,Air Traffic Control Provided Assistance; Flight Crew Requested ATC Assistance / Clarification,ATC Equipment / Nav Facility / Buildings,ATC Equipment / Nav Facility / Buildings,"During the approach briefing for the ILS approach to Runway 15 at LCH; the First Officer (Pilot Flying); informed the Captain that he had problems with the Runway 15 localizer on two previous flights for this runway. The FO (First Officer) said that on both previous flights; the Runway 15 localizer did not stay centered. The FO explained the Localizer Course Deviation Indicator (CDI) had swung left and right of course. After discussing this; the Captain and FO agreed that the FO would remain on GPS guidance while the Captain would monitor on the localizer radio guidance. After being cleared for the approach; The FO intercepted the inbound course on GPS guidance. The Captain's localizer guidance initially appeared stable. Approximately three miles prior to the final approach fix; FIDGA; the FO switched his course guidance to the localizer. The approach guidance was stable. We passed FIDGA; intercepted the glide slope; and began our final descent. At approximately 1;300 feet MSL; the localizer began deviating left and right of course. The autopilot was engaged. The FO disengaged the autopilot and we immediately descended below the cloud ceiling; which was approximately 1;100 feet MSL or 1;200 feet MSL. The Captain and FO both sighted the runway at 1;100 feet MSL. At some point below 1;000 feet MSL; the localizer appeared to be stable. The remainder of the approach was uneventful. During the approach; the winds were 40 knots from approximately 200 degrees; prior to the FAF. After clearing the runway; we reported the problem to the Control Tower. The FO informed the Tower Controller he had problems with the Runway 15 localizer on two previous occasions. The Tower Controller said he had not received any other notifications about problems with the localizer from any other aircrews. At no point was the approach unstable. [Request] inspection of the localizer antenna. A query to the LCH Control Tower to determine if other aircrews have experienced the same problem. A notification in the daily read warning aircrews they might encounter the same problem.",,,,"Air carrier Captain reported problems with the localizer inbound to LCH.",
1800479,202104,0601-1200,DEN.Airport,CO,,,,,,VMC,,,Daylight,,,TRACON D10,Air Carrier,Regional Jet CL65; Undifferentiated or Other Model,,2,Part 121,IFR,Passenger,,Descent; Initial Approach,,Class B DEN,,,,,,,,,,,,,,,,,,,,,,,,,,,,TRACON D01,Air Carrier,B757 Undifferentiated or Other Model,,2,Part 121,IFR,,,Descent; Initial Approach,,Class B DEN,,,,,,,,,,,,,,,,,,,,,,,,Aircraft X,Flight Deck,Air Carrier,Pilot Flying; First Officer,Flight Crew Multiengine; Flight Crew Instrument; Flight Crew Air Transport Pilot (ATP),,,Distraction; Situational Awareness,,,1800479,,,,,,,,,,,,Deviation / Discrepancy - Procedural Published Material / Policy; Inflight Event / Encounter Unstabilized Approach; Inflight Event / Encounter Wake Vortex Encounter,,,Person Flight Crew,In-flight,General None Reported / Taken,Human Factors; Procedure,Human Factors,"When on arrival and approach the flight was put 5nm in trail of a 757. This caused the aircraft to experience wake turbulence intermittently for the last approximately 100nm of the flight. While focusing on mitigation strategies for the wake; a loss of situational awareness occurred causing the pilot flying to become high and fast on approach. Aircraft was configured by 1;000 feet AGL; however was still stabilizing airspeed. Aircraft landed without incident. Increased spacing between heavy jets and regional jets would reduce the pilot workload on arrival and approach and thus minimize the chance of fixation on that issue.","Reporter stated spacing between different category aircraft should be increased.",,,"Regional Jet First Officer reported distractions from wake turbulence on arrival in trail of a B757 led to an unstabilized approach.",
1800908,202104,1201-1800,ZZZ.TRACON,US,,,,,,,,,,,,TRACON ZZZ,Air Carrier,B737 MAX Series Undifferentiated,,2,Part 121,IFR,Passenger,,Initial Approach,Visual Approach,Class B ZZZ,,,,,,,,,,,,,,,,,,,,,,,,,,,,,,,,,,,,,,,,,,,,,,,,,,,,,,,,,,,,,,,Aircraft X,Flight Deck,Air Carrier,Captain; Pilot Flying,Flight Crew Instrument; Flight Crew Multiengine; Flight Crew Air Transport Pilot (ATP),,,Time Pressure; Training / Qualification; Situational Awareness; Human-Machine Interface; Fatigue; Confusion,,,1800908,Aircraft X,Flight Deck,Air Carrier,First Officer; Pilot Not Flying,,,,Distraction; Situational Awareness; Time Pressure,,,1801150,ATC Issue All Types; Deviation - Speed All Types; Deviation / Discrepancy - Procedural Published Material / Policy; Inflight Event / Encounter Unstabilized Approach,,,Person Flight Crew,Other Post Flight,General None Reported / Taken,Aircraft; Software and Automation; Company Policy; Procedure; Manuals; Human Factors,Aircraft,"While flying I failed to fully configure by 1;000 feet AGL. Approach was a Visual Approach. Conditions were clear; 10-mile visibility; and light winds.When landing on Runway XX; TRACON had a restriction to cross a point at 2;600 feet. Configuration at that point was Gear and Flaps 15. Began the descent but had trouble initiating the descent due to automation configuration. During this phase of the approach for some reason I thought I had until 500 feet AGL for final configuration during a Visual Approach. Final configuration was accomplished by 700 feet. Later I referred to the Operating Manual and realized my mistake.Causal factors [included] a lack of recent flying. Aircraft was a B737 MAX and this was the first time I flew one in over X years. This aircraft does not slow down and go down like the B737 NG thus adding to configuration delay. Failure to remember that ALL approaches require final configuration by 1;000 feet. Pairing had a XC:10 Sign-In requiring me to get up at XA:30.  Although this occurred at approximately XI:00  I had already been awake for 9 hours; some of it on the back side of the clock. Perhaps have the same criteria for both IMC and VMC as far as being 'in the slot' this would eliminate any confusion at all. Bottom line; I confused the issue and will not allow that to happen again.",,"Approach Control told us to maintain 2;600 feet until north of a point.  The Final Approach Fix is south of this point and the altitude is 2;600 feet. The requirement to maintain 2;600 feet caused us to be high on approach. Passing 1;000 feet we were not stable and should have gone around. I felt Approach Control had set us up for failure. The Captain had a lack of recent flying experience and hadn't flown the MAX in two years. He thought being configured by 500 feet on a Visual Approach was acceptable. After landing we checked the manual and realized being stable by 1;000 feet is a requirement for all approaches. It's difficult to be stable by 1;000 feet with the restriction approach control gave us. This restriction is impractical and makes our job difficult.",,"Air carrier flight crew reported final configuration was not accomplished until 700 feet which is not in accordance with the manual.",
1802287,202104,0001-0600,AVL.Airport,NC,,,,5100,,VMC,,,Night,,,TRACON AVL,Air Carrier,Commercial Fixed Wing,,2,Part 121,IFR,Passenger,GPS,Initial Approach,Vectors,Class C AVL,,,,,,,,,,,,,,,,,,,,,,,,,,,,,,,,,,,,,,,,,,,,,,,,,,,,,,,,,,,,,,,Aircraft X,Flight Deck,Air Carrier,Pilot Not Flying; First Officer,Flight Crew Instrument; Flight Crew Multiengine; Flight Crew Air Transport Pilot (ATP),,,Situational Awareness,,,1802287,,,,,,,,,,,,ATC Issue All Types; Deviation / Discrepancy - Procedural Published Material / Policy; Inflight Event / Encounter Unstabilized Approach; Inflight Event / Encounter CFTT / CFIT,,,Automation Aircraft Terrain Warning; Person Flight Crew,In-flight,Air Traffic Control Provided Assistance; Flight Crew Took Evasive Action; Flight Crew Returned To Clearance; Flight Crew Requested ATC Assistance / Clarification,Human Factors,Human Factors,"During the approach briefing for RNAV GPS 35 at AVL; I had pointed out to the Captain that due to obstacles and terrain characteristics in the vicinity of AVL; ATC would keep us high until very close to the station. As anticipated; Atlanta Center kept us at a high altitude (I do not remember exactly; but well above 15;000) until about 12-15 miles from the station. Upon being handed to Asheville Approach; and considering the terrain; night time; and the need for sufficient airspace to descend to a reasonable altitude in order to execute an effective and stable approach; I requested radar vectors for the RNAV GPS 35 (glideslope for the ILS was out of service). Approach instructed us to descend to 6;000 and to a heading that would put the aircraft on a downwind to Runway 35.  Subsequently; the Approach Controller gave us a heading that put the aircraft on a left base leg to Runway 35; and instructed us to descend from 6;000 to 5;100. During this descent; the GPWS issued an aural TERRAIN caution. We immediately initiated a climb; advised ATC of the situation; and stopped the climb at 6;000; at which point the GPWS silenced. In addition; we advised we had the field in sight; and were cleared for a visual approach to Runway 35.  The minimum sector altitude corresponding to the left base leg to Runway 35 stated 6;200 ft. We should have queried ATC of the validity of the instruction to descend from 6;000 to 5;100.  From a CRM standpoint; The Jeppessen AVL Airport Reference Page alludes to the fact that a high rate of descent in the vicinity of the airport may cause a GPWS activation due to mountainous terrain in the vicinity (We did not exceed 1500 fpm); hence an emphasis on this matter during the approach briefing; in conjunction to minimizing the rate of descent to; perhaps; no more than 700 fpm; more than likely would have avoided the situation.",,,,"Air carrier First Officer reported a CFIT event during approach under Approach Control which was followed by an uneventful visual landing.",
1802702,202104,1201-1800,PHL.Tower,PA,,,,,,VMC,,,,,,Tower PHL,Air Carrier,EMB ERJ 145 ER/LR,,2,Part 121,IFR,Passenger,,Landing,,Class B PHL,,,,,,,,,,,,,,,,,,,,,,,,,,,,Tower PHL,Air Carrier,Commercial Fixed Wing,,2,Part 121,IFR,,,Landing,,Class B PHL,,,,,,,,,,,,,,,,,,,,,,,,Aircraft X,Flight Deck,Air Carrier,Captain; Pilot Flying,Flight Crew Multiengine; Flight Crew Instrument; Flight Crew Air Transport Pilot (ATP),,,,,,1802702,,,,,,,,,,,,Conflict Airborne Conflict; Inflight Event / Encounter Unstabilized Approach; Inflight Event / Encounter Wake Vortex Encounter,,N,Person Flight Crew,In-flight,Air Traffic Control Issued New Clearance; Flight Crew Executed Go Around / Missed Approach; Flight Crew Took Evasive Action,Environment - Non Weather Related; Procedure,Ambiguous,"We were on final approach for Runway 35 at PHL conducting a Flaps 22 visual approach and landing. Conditions were VMC and we were configured for landing by 1;000 ft. and stable by 800 ft. in accordance with policies requiring the aircraft to be configured by 1;000 ft. and stable by 500 ft. in visual conditions. We were notified by the Tower that an aircraft was landing on the intersecting 27R runway and that we were cleared to land on Runway 35. During my landing flare as we crossed the [Runway] 27R intersection we encountered wake turbulence from the previous arrival. The left wing suddenly dipped and I felt the aircraft enter only what I can describe as an enhanced ground effect where the aircraft was not sinking at the rate that it was prior to crossing the intersection. Due to this condition I felt as though the aircraft would not be able to touchdown in the Runway 35 TDZ and I called for and executed a go around. We completed the go around maneuver successfully and were vectored back around for a visual approach to RWY 27R where we landed uneventfully and taxied to the gate.The FO (First Officer) and I felt the wing dip and the aircraft began floating and my sink rate had ceased.I believe the cause of the wing dip and enhanced ground effect was due to wake turbulence from the previous RWY 27R arrival. This all happened as soon as we were over the [Runways] 27R/35 intersection in the landing flare. The aircraft was sinking normally during my flare prior to crossing the intersection.Feeling as though a touchdown in the touchdown zone would no longer be possible I elected to go around.Prior to this event I have landed on [Runway] 35 many times after an arrival on the intersecting runway and felt the wake of the landing aircraft. In this instance the effects of what we encountered far exceeded what I have ever felt before. Perhaps more information could be distributed to the flight crews regarding any other similar events if there is a pattern of this occurring.","Reporter stated more ATC awareness is needed in the area of possible wake from intersecting runways.",,,"Air Carrier Captain reported executing a go-around after encountering wake turbulence from previous arrival on an intersecting runway.",
