1667378,201907,1801-2400,JFK.Airport,NY,,,,,,IMC,Rain,,,,,Tower JFK,Air Carrier,B737 Undifferentiated or Other Model,,2,Part 121,IFR,Passenger,,Landing,,Class B JFK,,,,,,,,,,,,,,,,,,,,,,,,,,,,,,,,,,,,,,,,,,,,,,,,,,,,,,,,,,,,,,,Aircraft X,Flight Deck,Air Carrier,Pilot Not Flying; First Officer,Flight Crew Multiengine; Flight Crew Instrument; Flight Crew Air Transport Pilot (ATP),,,Distraction; Situational Awareness; Workload,,,1667378,Aircraft X,Flight Deck,Air Carrier,Captain; Pilot Flying,Flight Crew Multiengine; Flight Crew Air Transport Pilot (ATP); Flight Crew Instrument,,,Situational Awareness; Workload; Distraction,,,1667750,Deviation / Discrepancy - Procedural Published Material / Policy; Ground Excursion Runway; Inflight Event / Encounter Unstabilized Approach,,,Person Flight Crew,In-flight,General None Reported / Taken,Weather; Human Factors,Human Factors,"Planned for 22L arrival. On initial contact with arrival 22R was assigned.On short final GPWS constant 'below glide slope' call-outs. PAPI was all red. Noticing red side lights and PAPI location; I stated 'displaced-threshold'; Captain responded something like 'yes or got-it'. He reacted as if to land beyond. Power/Pitch. Landed close to displaced threshold; unsure if beyond or not.Change of planned runway. Lack of attention to airport diagram.",,"Planned on 22L ILS; cleared 22R ILS. Transitioned to visual when well clear of weather because of offset localizer; used 3 degree line on HUD; intended to land beyond displaced threshold and I think we did but not 100 percent sure.",,"B737 flight crew reported possibly landing before the displaced threshold by mistake.",
1667682,201907,,MCO.Airport,FL,,,,2500,,VMC,,,,,,TRACON MCO,Air Carrier,Large Transport,,2,Part 121,IFR,Passenger,,Final Approach,,Class B MCO,,,,,,,,,,,,,,,,,,,,,,,,,,,,,,,,,,,,,,,,,,,,,,,,,,,,,,,,,,,,,,,Aircraft X,Flight Deck,Air Carrier,Captain,Flight Crew Air Transport Pilot (ATP),Flight Crew Last 90 Days 164.12; Flight Crew Type 2602.27,,Workload,,,1667682,,,,,,,,,,,,ATC Issue All Types; Inflight Event / Encounter Unstabilized Approach,,,Person Flight Crew,In-flight,General None Reported / Taken,Airspace Structure; Aircraft; Procedure,Procedure,"[I] have wanted to write this up many times but always forget by the time I get to the hotel. Did the visual 18R approach into MCO tonight. The controller demanded that aircraft stay at 2;500 feet until crossing the VOR before descending. Doing so puts you extremely high on both instrument and visual glide path; creating an extreme unstable approach just to get back on glide path. This ALWAYS causes full glide slope deflection and 4 white on the VASI. Knowing that we are put into this situation deliberately by ATC is extremely irresponsible. This is an absolute safety hazard and should not be happening and not be tolerated. I presume this is being done to provide separation with the small GA airport under the approach path. Making hundreds of transport carrier commercial flights a day deliberately perform very unstabilized approaches for the benefit of a small GA airport is crazy. Perhaps make those operating from that small field stay low instead of us staying high. I had full scale deflection and was fully configured yet still had to descend at nearly 2000 FPM from 2500 ft. to 1000 ft. just to catch the glide slope from above. Simply unsafe. By the way; as I'm sure you know; TPA plays the same crazy game landing to the north with McDill under the approach path.",,,,"B737 Captain raised concerns about ATC procedures into MCO that forces pilots to fly an unstabilized approach.",
1668372,201907,1201-1800,ZZZ.Airport,US,,,1500,,,VMC,,,Daylight,,,Tower ZZZ,Air Carrier,B777-200,,2,Part 121,IFR,Passenger,,Initial Approach,,Class C ZZZ,,,,,,,,,,,,,,,,,,,,,,,,,,,,,,,,,,,,,,,,,,,,,,,,,,,,,,,,,,,,,,,Aircraft X,Flight Deck,Air Carrier,Pilot Flying; Captain,Flight Crew Instrument; Flight Crew Multiengine; Flight Crew Air Transport Pilot (ATP),,,Confusion; Physiological - Other,,,1668372,,,,,,,,,,,,Deviation - Altitude Excursion From Assigned Altitude; Deviation - Speed All Types; Deviation / Discrepancy - Procedural Published Material / Policy; Flight Deck / Cabin / Aircraft Event Illness / Injury; Inflight Event / Encounter Unstabilized Approach,,,Person Flight Crew,In-flight,General Physical Injury / Incapacitation,Human Factors,Human Factors,"As we were descending onto a downwind at ZZZ airport I started to sweat a little bit and turned my vent on. Turning base to final the autopilot started crisscrossing centerline trying to establish. I took over manually and was having a hard time concentrating on flying the airplane. I felt like I was woken from a REM sleep. I had been awake for over 2 hours. I had a difficult time doing two things at once. I wasn't scanning; just staring. My FO (First Officer) and [Relief Pilot] were offering guidance but sounded like distant voices. Around 700 ft. AGL I managed to force myself to concentrate and made a pretty sweet landing and turnoff. Upon setting brakes after a short 4 minute taxi I ran back to the bathroom and threw up a significant volume. The nausea hit me immediately. I threw up several times in a bag in the crew van and also a few more times at the hotel. I don't know what happened. I think I was developing physical symptoms of illness in the terminal area. Not the nausea which hit after parking the brakes. Maybe my blood pressure dropped or something but I was mentally out of it mostly on the approach. I didn't take any medicines or supplements but I did eat 4 hours before I got sick. It was clear and a million on the approach and though I only have been in the 777 [for several months] I have flown into ZZZ a couple dozen times. I felt OK; about 80%; the following morning and just slept all day. By pickup that evening I was fine. Though my chest was very sore from dry heaving. On the approach I think I exceeded flaps 30 max speed of 170 KIAS as well. The IAS was plus or minus 15-20 knots as it was very gusty from 4000 ft. to touchdown. I also had a glide slope warning at about 1500 ft. AGL I was told but I don't remember it. I think I experienced an initial insidious physiological sensory degradation from food poisoning. As I descended onto downwind. That's all it could be. I was so sick for the rest of the evening and the vomiting started maybe 8 minutes after the awful approach I conducted. I just do not fly an airplane that bad.",,,,"B777 Captain reported feeling partially incapacitated during the final phase of flight; possibly due to food poisoning.",
1668610,201907,0601-1200,PHX.Airport,AZ,,,,,,VMC,,,Daylight,,,TRACON P50,Air Carrier,A319,,2,Part 121,IFR,Passenger,,Final Approach,Visual Approach,Class B PHX,,,,,,,,,,,,,,,,,,,,,,,,,,,,,,,,,,,,,,,,,,,,,,,,,,,,,,,,,,,,,,,Aircraft X,Flight Deck,Air Carrier,Pilot Flying,Flight Crew Instrument; Flight Crew Air Transport Pilot (ATP); Flight Crew Multiengine,Flight Crew Total 18000,,Time Pressure; Situational Awareness; Fatigue; Confusion; Distraction,,,1668610,Aircraft X,Flight Deck,Air Carrier,First Officer; Pilot Not Flying,Flight Crew Instrument; Flight Crew Air Transport Pilot (ATP); Flight Crew Multiengine,Flight Crew Total 4500,,Confusion; Distraction; Situational Awareness; Workload,,,1668612,Deviation / Discrepancy - Procedural Published Material / Policy; Deviation / Discrepancy - Procedural Landing Without Clearance; Inflight Event / Encounter Unstabilized Approach,,,Person Flight Crew,In-flight,Flight Crew Requested ATC Assistance / Clarification,Procedure; Company Policy; Human Factors,Human Factors,"I was flying the aircraft when the following events occurred. Approach had kept us up unusually high (4;000 feet) during the turn to base to land. We were on the arrival and last assigned airspeed was 210 knots. We were also vectored in tight to the final approach fix which was 3;000 feet and above on approach plate. When asked if the field was in sight and after answering yes; we were given a dog leg to final still at 4;000 feet and last assigned airspeed of 210 knots and flaps 1. Then we were cleared for the Visual Approach. I immediately turned off the autopilot and selected 170 knots in airspeed window and then selected managed speed; auto thrust still on and began descending. We dropped the gear just under 4;000 feet in the effort to slow and configure and get on a visual glide path on the VASI. Being fairly new to the Airbus fleet; I didn't recognize the depth of the situation in terms of getting slow to configure and getting on proper glide path.I thought the aircraft could hack it especially since I was hand flying. We established gear and flaps 3 before 1;000 feet but had briefed full flap approach. Approaching 1;000 feet the First Officer mentioned flaps not at full and during the time compression I was experiencing; I was wondering why he mentioned that because I still had till 500 feet to be fully configured. WRONG-just goes to show you. Another causal event; this one in my mind that we could still get flaps to full by 500 feet and continue to land. I confused the stable call by 500 feet in VMC. It doesn't matter how many times or hours you've been fully configured by 1;000 feet my mental confusion perplexed the First Officer and I think he was a little reluctant to call for a go around which is exactly what I should have initiated probably on the dog leg. We got flaps to full at 534 feet AGL. I had still confused fully configured by 1;000 feet after blocking in and said we got flaps just in time. I didn't hear the 500 foot call and was so intent on looking outside and looking at airspeed that I can't confirm at what altitude I called stable. Neither one of us heard Approach tell us to contact Tower; and in the heat of the battle; we forgot to switch frequencies. I think I called for a Before Landing Checklist but I'm not certain. We landed without clearance from Tower. I talked to the Tower Supervisor on my phone after blocking in and he said they gave us a green light to land so we really did have clearance to land. I didn't see that light either nor was I looking for one. I landed the aircraft smoothly on speed well within the 800 to 1500 foot landing zone. I asked Tower why we weren't given a slower airspeed on base leg and he said approach normally assigns 170 till 5 miles. We weren't directed to slow and my XX years of flying out of another airport reminded me while I was flying the aircraft how upset ATC got if you slowed early on base leg. In the future; I need to ask for a slower speed if not told to slow and also not accept such a tight turn to final. I went to bed at XA15 local; fell right to sleep; and my alarm was set for XI30-we had a XJ40 van show. I like to check flight info concerning weather; airfields and aircraft status before I pull the flight plan. I heard a loud noise in hallway and woke up at just after XT00 local. I always sleep with earplugs on layovers to avoid the noise but they didn't help last night. I tossed and turned for rest of night and got up at XI15 while getting maybe a few minutes more of sleep. I was tired but really not much more so than after 8 hours of sleep. A cup of coffee at airport helped. A fatigued call didn't cross my mind at all especially after the coffee. In retrospect I feel I wasn't at my A game and the slam dunk on approach and my mistakes certainly confirm that to me. I discussed how to be more assertive with old Captains and thoroughly discussed what lessons I learned with my First Officer.",,"[Report narrative contains no additional information.]",,"A319 flight crew reported they were turned on to final above glide path and landed; aircraft was not configured on a stabilized approach at the appropriate altitude and they was not in contact with the Tower.",
1669196,201906,,,,,,0,,,,Thunderstorm,,,,,,Air Carrier,B777 Undifferentiated or Other Model,,2,Part 121,IFR,Passenger,FMS Or FMC,Landing,,,,,,,,,,,,,,,,,,,,,,,,,,,,,,,,,,,,,,,,,,,,,,,,,,,,,,,,,,,,,,,,,Aircraft X,Flight Deck,Air Carrier,Captain,Flight Crew Multiengine; Flight Crew Instrument; Flight Crew Air Transport Pilot (ATP),,,Situational Awareness; Time Pressure,,,1669196,,,,,,,,,,,,Deviation / Discrepancy - Procedural Published Material / Policy; Ground Event / Encounter Other / Unknown; Inflight Event / Encounter Unstabilized Approach; Inflight Event / Encounter Weather / Turbulence,,,Person Flight Crew,In-flight,Flight Crew Regained Aircraft Control,Human Factors; Company Policy; Weather,Human Factors,"This was very much a convective weather day. Our flight had been impacted with multiple re-routes and holding; and substantial deviation around cells close to the airport to get us to final approach on runway 7. The approach was stable until short final when a substantial sink rate developed. I had to aggressively add power and back pressure to arrest the sink. These control inputs did not prevent runway contact; but did result in a bounce. Back in the air; I realized that in my attempt to arrest the sink; I had not pulled the power off before contacting the runway. Still; seeing adequate runway remaining; and knowing that there was weather very close to the field and getting closer; I decided to re-enter the landing maneuver; pulled the power; and re-established the landing attitude; which was a mistake. With the engines still spooled; I should have gone around. But I didn't. When I pulled the power; the spoilers deployed; and this time the landing was 'hard'; but the landing stuck; and we rolled out and taxied to the gate normally. If I had it to do over again; I wouldn't bother with the second landing attempt. I'd just go around.",,,,"A Boeing 777 captain reported a hard landing following an initial bounce after touching down.",
1669646,201907,0001-0600,DFW.Airport,US,,,,2250,,VMC,,,,,,Tower DFW,Air Carrier,A321,,2,Part 121,IFR,Passenger,FMS Or FMC,Other Go Around,Visual Approach,Class B DFW,,,,,,,,,,,,,,,,,,,,,,,,Autoflight System,,X,Malfunctioning,,,,,,,,,,,,,,,,,,,,,,,,,,,,,,,,,,,,Aircraft X,Flight Deck,Air Carrier,Captain; Pilot Flying,Flight Crew Multiengine; Flight Crew Instrument; Flight Crew Air Transport Pilot (ATP),Flight Crew Total 9400,,Time Pressure; Situational Awareness; Human-Machine Interface; Distraction; Confusion; Communication Breakdown,Party1 Flight Crew; Party2 ATC,,1669646,,,,,,,,,,,,Aircraft Equipment Problem Less Severe; Deviation - Altitude Overshoot; Deviation - Altitude Crossing Restriction Not Met; Deviation - Speed All Types; Deviation / Discrepancy - Procedural Clearance; Inflight Event / Encounter Unstabilized Approach,,,Person Flight Crew; Person Air Traffic Control,In-flight,Air Traffic Control Provided Assistance; Flight Crew Became Reoriented; Flight Crew Executed Go Around / Missed Approach; Flight Crew FLC Overrode Automation; Flight Crew Requested ATC Assistance / Clarification,Human Factors; Aircraft,Aircraft,"On visual approach to Runway 17C we were assigned 170kt to 5 miles. We were fully configured when I pushed the speed selector to establish managed mode so the aircraft would slow to approach speed. I noticed when passing through 1;200 ft. that the aircraft was still maintaining 170 kt. I re-selected managed speed; but in the descent with a tailwind the aircraft was still approximately 40 knots fast and we were approaching 500 ft. I knew we would be too fast at 500 ft. so I told the FO (First Officer) we had to go around; said 'Go Around TOGA' while advancing the thrust levers to TOGA (Takeoff/Go-Around). I had experienced a previous go-around about 2 months before where the FO had set TOGA and SRS (Speed Reference System) never engaged; so I left the thrust levers in TOGA for a 3-count; then said 'Climb' and selected climb thrust. ATC gave us a 140 heading; and as I started turning I noticed the FMA (Flight Mode Annunciator) still displayed 'LAND'. I was distracted and went through our heading. ATC clarified the assigned heading and we turned back. The FO restated the altitude assigned was 2;000 ft. I saw we were at about 2;250 ft. and returned to our assigned altitude. I don't believe I heard the original ATC assigned altitude because I was trying to make sure the automation was correct before restoring the autopilot; so my expectation was we were going to 3;000 ft. All in all it was a very messy go-around. Primarily; the airplane did not do what I expected it to; resulting in my becoming task saturated and distracted. The initial reason for the go-around was selecting managed mode didn't resulting in the aircraft slowing to approach speed. I could have trapped that error by confirming the blank window and verifying in the FMA. This alone would have likely resulted in a stabilized approach and a normal landing. A contributing factor was the tailwind. We may have been able to be stabilized at 500 ft. - hard to say for sure. The rest was caused by task saturation when the expected automation did not engage. I still do not understand why because I deliberately advance the thrust levers to TOGA and left them there for a 3-count. FOQA (Flight Operational Quality Assurance) told me the data shows we only went to MCT/FLX (Manual Thrust Mode). I know where I moved the thrust levers to because I was calm but deliberate in my actions. I made the mistake of not verifying SRS in the FMA; but even if I had looked and it still said 'LAND'; which it did; I do not know what the procedure is or if one exists except to fly the airplane; which I did. Once corrected by ATC on the heading; we returned to our assigned heading and altitude. I do not recall if ATC corrected our altitude - we were only off by 250 ft.; still unacceptable; but I believe my FO advised the altitude deviation. If you were to tell me ATC queried our altitude I would believe you - I was attempting to avoid over speeds because the auto throttle did not engage as commanded. The soft go around is supposed to be a calm; slow procedure. When the automation did not do what I expected; we as a crew had a difficult time putting the pieces back together. The decision to go-around was the right one because we were unstable. I believe I did the procedures correctly until I ran out of procedures. I think training on re-establishing automation would be extremely helpful. We fly considerable more visual approaches than instrument procedures; yet the majority of our training focuses on procedures that we have robust SOP (Standard Operating Procedure) for with back-up support documents. The only guidance provided for a manual go-around without SRS engaging the go-around mode assumes a system failure. I have seen this twice now in 2 months; in both cases the thrust levers were advanced to TOGA; yet go-around phase was not engaged. Training on how to 'put Humpty Dumpty back together' would significantly reduce the distractions caused by confusion about re-establishing automation. I don't know for sure because I was focused on flying; but when I called 'set speed 210' and 'open climb' I do not believe anything happened with the automation. 'LAND' was still displayed until we were well into the go around procedure and we were able to re-establish automation by cycling the FD (Flight Display) switches; pushing the auto throttle button; and I commanded 'Autopilot 1'.",,,,"A321 Captain reported the automation for a go around did not engage; resulting in an altitude and heading deviation.",
1671011,201907,0001-0600,SAT.Airport,US,,,,,,VMC,,,,,,TRACON SAT,Air Carrier,A319,,2,Part 121,IFR,Passenger,,Initial Approach,Visual Approach,Class C SAT,,,,,,,,,,,,,,,,,,,,,,,,,,,,,,,,,,,,,,,,,,,,,,,,,,,,,,,,,,,,,,,Aircraft X,Flight Deck,Air Carrier,Pilot Flying; Captain,Flight Crew Instrument; Flight Crew Multiengine; Flight Crew Air Transport Pilot (ATP),Flight Crew Total 15000,,Fatigue; Training / Qualification; Communication Breakdown,Party1 Flight Crew; Party2 Flight Crew,,1671011,,,,,,,,,,,,Deviation / Discrepancy - Procedural Published Material / Policy; Inflight Event / Encounter Unstabilized Approach,,,Person Flight Crew,In-flight,Flight Crew Executed Go Around / Missed Approach,Procedure; Human Factors,Human Factors,"ATC had been vectoring our aircraft so as to fit other traffic in front of us. After we were clear for the visual approach; we were too high for safe approach in my judgment. The FO (First Officer) said; 'I am going to maneuver the aircraft' and began to S turn. I stated 'No we are not' and 'Go Around' A Soft Go Around was accomplished. The FO wanted to hack the approach by S turning from what would be a steep approach. The FO had been up for 21 hours at this point as he is a commuter who got up at 2am PDT the previous day I think the FO was tired and just wanted to put it on the ground. His subsequent landing was quite hard. I believe his judgment was affected by fatigue. Ultimately we did the right thing by going around. Unfortunately; I; as the Captain had to command it.",,,,"A319 Captain reported having to command a go around to fatigued First Officer on an unstabilized approach.",
1671030,201908,1201-1800,DEN.Airport,CO,,,1000,,,VMC,,,Daylight,,,Tower DEN,Air Carrier,Regional Jet 200 ER/LR (CRJ200),,2,Part 121,IFR,Passenger,FMS Or FMC,Initial Approach,Visual Approach,Class B DEN,,,,,,,,,,,,,,,,,,,,,,,,,,,,,,,,,,,,,,,,,,,,,,,,,,,,,,,,,,,,,,,Aircraft X,Flight Deck,Air Carrier,Captain; Pilot Not Flying,Flight Crew Instrument; Flight Crew Multiengine; Flight Crew Air Transport Pilot (ATP),,,Situational Awareness; Fatigue,,,1671030,,,,,,,,,,,,Deviation / Discrepancy - Procedural Published Material / Policy; Inflight Event / Encounter Unstabilized Approach,,,Person Flight Crew,In-flight,Flight Crew Executed Go Around / Missed Approach,Company Policy; Human Factors,Company Policy,"Failed to fully configure aircraft. Both of us were focused on the aircraft in front of us; talking about the fact that he wasn't moving off the runway fast enough. Focused on that; we forgot to put gear down and complete configuration. Received the gear horn descending through 1;000 ft. with flaps 20. It took us a second or two to realize what just happened. I looked down and saw our altitude of 870 ft. and called for a go-around. Tower asked the reason and I replied that we weren't fully configured. They questioned us to make sure it wasn't their fault that we were too close but it wasn't their fault. Normal go-around followed by normal approach and landing. Just exhausted; I came off 2 full days off with decent sleep but only slept about 2 hours during the overnight. Eliminate stand-ups; the continuous duty-periods of them go completely against everything we know about fatigue; circadian rhythm; etc.",,,,"Captain reported fatigued resulted in a go around due to aircraft not being properly configured.",
