1625091,201902,1801-2400,BOS.Airport,MA,,,1000,,,,Icing,,,,,Tower BOS,Air Carrier,EMB ERJ 190/195 ER/LR,,2,Part 121,IFR,Passenger,,Initial Approach,,Class B BOS,,,,,,,,,,,,,,,,,,,,,,,,,,,,Tower BOS,,Any Unknown or Unlisted Aircraft Manufacturer,,,,,,,Landing,,Class B BOS,,,,,,,,,,,,,,,,,,,,,,,,Aircraft X,Flight Deck,Air Carrier,First Officer; Pilot Not Flying,Flight Crew Multiengine; Flight Crew Instrument; Flight Crew Air Transport Pilot (ATP),,,,,,1625091,,,,,,,,,,,,Aircraft Equipment Problem Less Severe; Inflight Event / Encounter Wake Vortex Encounter; Inflight Event / Encounter Weather / Turbulence; Inflight Event / Encounter Unstabilized Approach,,,Person Flight Crew,In-flight,Flight Crew Executed Go Around / Missed Approach,Aircraft; Environment - Non Weather Related,Ambiguous,"We were on approach to the Boston Airport and encountered an uncommanded roll of the aircraft above approximately 1000 ft. We executed a go around due to the numerous aircraft faults with AOA probe fails; stall protection failures; etc. To assess the situation and run the QRH procedures. After all of that was accomplished we landed uneventfully and taxied to the gate in Boston. At the time there was a lot of light to moderate rime icing in the area. The event most likely occurred either because of wake turbulence from the aircraft in front of us or due to the icing in the area.",,,,"ERJ-190 reported executing a go-around at BOS airport after experiencing an uncommanded roll approaching 1000 feet. Cause of the roll was undetermined; but could have been related to a wake encounter or icing conditions.",
1628021,201903,1801-2400,ZZZ.Airport,US,,,0,,,VMC,,,,,,Tower ZZZ,,Citation Excel (C560XL),,,,,Test Flight / Demonstration,,Takeoff / Launch,,Class C ZZZ,,,,,,,,,,,,,,,,,,,,,,,,Flap Control (Trailing & Leading Edge),,X,Malfunctioning,,,,,,,,,,,,,,,,,,,,,,,,,,,,,,,,,,,,Aircraft X,Flight Deck,,Captain; Pilot Flying,,,,Situational Awareness,,,1628021,,,,,,,,,,,,Aircraft Equipment Problem Critical; Deviation - Altitude Excursion From Assigned Altitude; Inflight Event / Encounter Unstabilized Approach,,,Person Flight Crew,In-flight,General None Reported / Taken,Aircraft; Human Factors,Aircraft,"Maintenance test flight.Crew requested to perform a functional test flight on the aircraft after several maintenance events; to include a declared emergency following gear issues; and failure of both engines to run due to lack of ignition & fuel flow on both #1 & #2 engines in separate events.The maintenance test flight was again attempted to be bypassed by departments at the office; as the ERTS (Expected Return To Service) placed on the jet was consistently followed in a short time by live legs; or early morning trips without a maintenance flight being placed into the schedule. Maintenance Control seemed to understand the crew's needs and wants to perform a functional flight; but the schedule was never built to allow a jet (which had been down for about 3 weeks at this point for various issues) to be test flown.Preflight inspections and W&B (Weight and balance) calculations were completed prior to the crew taxiing out. The only odd indications crew had during taxi checks was a noted looseness on the TR (Thrust Reverser) levers which was not there previously. TR checks were normal otherwise; so crew took note of the situation and continued the taxi to the runway.Upon liftoff; I noted a strong pitch up in the nose; and difficulty in pushing the nose forward (down); using electric trim. I asked my Copilot to confirm the trim was moving; and they indicated it was; albeit slowly. Cleaning up gear and flaps returned the aircraft to a more normal feel in the controls and the crew verbalized a need to mention the trim movement when returning from the flight.The goal of the maintenance flight was to perform gear swings in order to confirm functionality of both the uplocks and 'down & locked' indications. I placed the plane on autopilot and continued to climb to 4000 feet; and attempted to avoid clouds building in the vicinity. Once we were clear; we slowed the jet to under 200 kts and tested the gear a few times. Once we were satisfied the gear was functioning properly; we informed ATC the purpose of our flight was complete and we were ready to head in. ATC gave us a left downwind vector for Runway XXR. Once established; and still on auto pilot; I requested flaps 7 at 4000 ft. and 195 kts. A few seconds after my copilot moved the flap lever; the jet began an extremely significant pitch up attitude and autopilot disengaged. I grabbed the yoke and began trying to pitch the nose down; and apply nosedown trim at the same time; with no movement sensed. My copilot noted the trim was full nose down already & not moving. I requested help in shoving the nose forward and we both began pushing forward with full strength. We were able to arrest the climb some; but not push the nose forward completely. I asked my copilot to take out the 7 degrees of flaps we had just selected. Within a second; the back pressure began easing on the yoke; and we were able to return to a normal attitude again - after having climbed about 1000 ft. My copilot noted the altitude change and I began descending back down to our assigned 4000 ft. and ATC was informed of our issue and that we were descending again to our assigned altitude. With the volatility of the flaps; the crew decided we would perform a no-flap landing & informed Tower we needed the longer runway due to our situation; and requested extra time to run our abnormal checklist. We referenced the QRH for a no flap landing; making our Ref (Reference) speeds and landing distance calculations to determine the 9000 ft. available on [Runway] XXL; (at a Ref speed of 122kts) would be sufficient for our situation. I requested gear down in order to help keep us slow; and we informed Tower we were ready to turn in for the approach.We informed Tower of our situation and the fact that we would be remaining slow on a several-mile (10+) final approach. Tower began moving traffic behind us to XXR in response; and requested that traffic further out begin to slow to their approach speeds due toour situation.There were scattered clouds; no precipitation and winds were 020 at 19 kts; we landed uneventfully with plenty of runway remaining. No mention was made of the altitude deviation made by the crew while fighting the pitch up attitude.Maintenance test flights should be conducted with any significant Maintenance event. There should not be any pushback for doing something that helps ensure safety to crew and passengers in favor of placing a revenue flight on the plane.Each time we flew; or attempted to fly; this aircraft we had significant Maintenance events. I recommend this particular aircraft; given it's notorious record of significant Maintenance events; receives a full inspection event be performed on the jet to help catch and prevent further serious issues; or possibly worse; in the future.",,,,"Captain reported severe pitch-up after flap extension and conducted no-flap landing.",
1630237,201903,1201-1800,ZZZ.Airport,US,,,0,,,VMC,10,,Daylight,12000,,Tower ZZZ,Other Aerial Survey,Cessna Twin Piston Undifferentiated or Other Model,,2,Part 91,None,Training,,Landing,Visual Approach,Class D ZZZ,,,,,,,,,,,,,,,,,,,,,,,,Landing Gear,,X,Malfunctioning,,,,,,,,,,,,,,,,,,,,,,,,,,,,,,,,,,,,Aircraft X,Flight Deck,Contracted Service,Trainee; Pilot Not Flying,Flight Crew Commercial; Flight Crew Multiengine,Flight Crew Last 90 Days 9; Flight Crew Total 837; Flight Crew Type 8,,Confusion; Training / Qualification; Communication Breakdown,Party1 Flight Crew; Party2 Flight Crew,,1630237,,,,,,,,,,,,Aircraft Equipment Problem Critical; Deviation / Discrepancy - Procedural Published Material / Policy; Ground Event / Encounter Gear Up Landing; Inflight Event / Encounter Unstabilized Approach,,,Person Air Traffic Control; Person Flight Crew,Other landing,Aircraft Aircraft Damaged,Human Factors,Human Factors,"CFI and I departed ZZZ for survey work near ZZZ1 airport. This imagery project required us to be below 117 kts ground speed at 1;000 feet AGL. CFI was instructing me on how to fly survey lines following their FMS system. Because the aircraft was so slow; the gear warning horn was activated. CFI pulled the circuit breaker. After completion of this project; we headed for other projects to the east. We were cleared into Class Bravo airspace and started our pre-coordinated survey work. CFI handled all radio calls at this point as he instructed me on flying the lines. After completing this project; we started another which ran north and south; and was located east of ZZZ2 and ZZZ3. About half way through our project; we were instructed to make a left turn to the north by ATC. CFI asked if instead we could head to another project northwest of ZZZ4 since clouds were interfering with our current project. This was approved by ATC. After completion of this project; we landed at ZZZ4 for fuel and to reevaluate the weather. After we departed ZZZ4 we headed to one more project. This project was flown at 1;000 feet AGL and had a speed restriction to be below 120 kts groundspeed. CFI pulled the circuit breaker and I did not hear a gear warning horn. I did not recognize that he had pulled the breaker at the time. Upon completion of this project; we headed back to ZZZ. I was being instructed on power management. I did not descend fast enough for the straight in approach to Runway XX we were assigned by Tower. On about a 1.5 mile final; we were hundreds of feet too high and our speed was 180 kts. I said 'I need to level off' because I wanted to slow to 160 to put down the gear. CFI said 'No you need to get down now' and pushed the yoke forward into a steep descent which I then continued. CFI began adjusting power; activating speed brakes; putting flaps down and the gear handle. He was also telling me to get on center line. Seconds before touchdown; there was a call on the radio 'Go around; go around; go around'; however; I knew it was not CFI saying it and neither of us knew who was saying it or that it was directed at us since we were focused on landing. The airplane touched down around on center line and slid a few hundred feet drifting to the left side of the runway. CFI and myself had both failed to identify that the gear was down and locked. The gear warning horn and gear circuit breaker had been pulled by CFI without my knowledge. We exited the plane without any injuries. The Fire Department came and investigated to find that no one was injured and there was no risk of fire. This was only my second day of flying with [Company] as part of a three week training program. Prior to my employment [Company]; I had no prior experience with aircraft [type]. I feel that there are many things that contributed to this but it could have been avoided. Below I have listed things that contributed or would have helped avoid this occurrence. - Had the circuit breakers not been pulled; I think we would have had a much better chance of identifying the gear was not down. - If there were established procedures for when a circuit is pulled for a project; that both pilots are required to verify it has been pushed back in before landing. - If more time was given to review the POH; checklist and flows for the aircraft. - If either CFI or I were completely in control of the aircraft rather that splitting responsibility. - Double checking to make sure there were three green lights indicating the gear was down and the front wheel was seen in the mirror.",,,,"Aerial survey pilot not follow procedure and landed gear up.",
1633420,201904,1801-2400,EWR.Airport,NJ,,,600,,,VMC,,,,,,Tower EWR,Air Carrier,A320,,2,Part 121,IFR,Passenger,,Final Approach,,Class B EWR,,,,,,,,,,,,,,,,,,,,,,,,,,,,,,,,,,,,,,,,,,,,,,,,,,,,,,,,,,,,,,,Aircraft X,Flight Deck,Air Carrier,Pilot Flying; First Officer,Flight Crew Instrument; Flight Crew Air Transport Pilot (ATP); Flight Crew Multiengine,Flight Crew Last 90 Days 14; Flight Crew Type 1064,,Situational Awareness,,,1633420,,,,,,,,,,,,Deviation / Discrepancy - Procedural Published Material / Policy; Inflight Event / Encounter CFTT / CFIT; Inflight Event / Encounter Unstabilized Approach,,,Person Flight Crew,In-flight,Flight Crew Overcame Equipment Problem,Human Factors; Aircraft,Aircraft,"Rolling out on final over CHUMR in the descent to cross at 500' we simultaneously got a low altitude alert call out from tower and an aural 'Caution Obstacle' from the jet. We were on the stadium visual arrival to runway 29 due to strong and gusty winds out of the west. We had the RNAV 29 loaded flying a manage-managed approach with autopilot and auto thrust OFF. We were slightly above the vertical profile and on the lateral course at the time of the incident. I immediately leveled off until the situation was reconciled and was able to recapture a normal visual glide path. The approach was continued to a normal landing.",,,,"A320 First Officer reported EGPWS alert during approach.",
1633586,201904,1801-2400,ZZZ.Airport,US,,,,,,VMC,,,Dusk,,,,Air Carrier,Regional Jet 200 ER/LR (CRJ200),,2,Part 121,IFR,Passenger,,Initial Approach,,Class E ZZZ,,,,,,,,,,,,,,,,,,,,,,,,,,,,,,,,,,,,,,,,,,,,,,,,,,,,,,,,,,,,,,,Aircraft X,Flight Deck,Air Carrier,Pilot Not Flying; Captain,Flight Crew Instrument; Flight Crew Multiengine; Flight Crew Air Transport Pilot (ATP),,,Situational Awareness; Training / Qualification,,,1633586,Aircraft X,Flight Deck,Air Carrier,First Officer; Pilot Flying,Flight Crew Multiengine; Flight Crew Instrument; Flight Crew Air Transport Pilot (ATP),,,Training / Qualification,,,1633573,Deviation / Discrepancy - Procedural FAR; Deviation / Discrepancy - Procedural Published Material / Policy; Inflight Event / Encounter Unstabilized Approach,,,Person Flight Crew,In-flight,Flight Crew Became Reoriented,Human Factors; Manuals; Procedure; ATC Equipment / Nav Facility / Buildings,Human Factors,"Enroute to ZZZ I sent for the METAR via ACARS; based on that information the FO (First Officer) briefed the ILS RWY XX. As we descended we were finally able to pick up the current ATIS which was advertising visual approaches for RWYs XY and XZ. The winds were favoring XZ so we briefed the visual backed up with lateral guidance from the RNAV Y XZ. As we got closer to the airport a company aircraft; arriving prior to us; requested the RNAV Y XZ. Approach control told us to expect the same; so the FO briefed a few more things on the approach plate and we continued towards the airport. The airport was VFR during the current ATIS period; we would be starting the approach in IMC but would be in VMC as soon as descending from 8000 ft. Myself and the FO were able to see the airport from over 10 miles out and proceeded visually to the field. Approaching the FAF we started our descent and noticed the 'snowflake' guidance required a higher than normal vertical speed; up to 1300 ft/minute in some cases. I referenced the chart and noticed; based on our ground speed and a 3.7 degree glide path; that a higher than normal VS was appropriate. During the debrief the FO noticed that category D aircraft are not authorized for that particular approach. Based on that finding we should have executed a go-around and set up a visual approach in the FMS using vertical guidance from the PAPIs. This was the first time into this airport for both myself and the FO; we became complacent after receiving the ATIS with the assumption we would be conducting a visual approach. We decided to use lateral guidance via the RNAV due to the terrain around the airport. I was not diligent when reviewing the chart after being told to expect that particular approach since we weren't going to be in IMC for very long. I didn't suspect anything to be out of place due to the higher approach angle of the approach path and a fast ground speed. Also the fact that a company aircraft had just flown the approach didn't give me a reason to suspect that we couldn't fly that particular approach. Even though the chart itself listed 'Cat A; B; and C only' in the header section; it didn't quite register for some reason. I thoroughly read the airport information page and it would have been helpful to have a note or ACARS message that says that particular approach in a CRJ-200 is prohibited. This is the first runway I've attempted an approach on that doesn't allow all aircraft speed categories so it's something I became complacent about.",,"On descent we followed company traffic to same runway in VMC. We decided that it was best to back the Visual with a RNAV/GPS approach so we would have vertical and lateral guidance into an unfamiliar airport for both myself and the Captain. We were cleared for the GPS approach and somewhere along the final approach segment we received one aural 'terrain.' The approach was stable and we landed without incident. During our debrief we discussed that this approach required the steep descent (3.76 degrees) and during our debrief we then noticed that category D was N/A.We were unable to pick up weather and determine the runway in use; so we briefed this approach and another approach not sure which runway was favored. We received runway assignment late and followed company traffic. We were cleared for the GPS approach and continued in visual conditions. Due to the steep descent angle of 3.76 degrees we received aural 'terrain.'There should be a filter in scheduling pairs to prevent a new FO (First Officer) and Captain from being paired together and it would be great if the filter prevented a crew to fly to airports that neither the FO nor Captain have been to. With it being the first time the Captain and I flying into this airport; we should have thoroughly reviewed the approaches available at this airport.",,"CRJ-200 flight crew reported following incorrect approach procedure for aircraft type.",
1633615,201904,1201-1800,ZZZ.Airport,US,,,,3100,,VMC,,,Daylight,,,TRACON ZZZ,Air Taxi,Gulfstream IV / G350 / G450,,2,Part 135,,Passenger,FMS Or FMC; Localizer/Glideslope/ILS Runway 28R,Initial Approach,,Class C ZZZ,,,,,,,,,,,,,,,,,,,,,,,,,,,,,,,,,,,,,,,,,,,,,,,,,,,,,,,,,,,,,,,Aircraft X,Flight Deck,Air Taxi,Pilot Flying; Captain,Flight Crew Instrument; Flight Crew Multiengine; Flight Crew Air Transport Pilot (ATP),,,Situational Awareness; Workload; Confusion; Distraction,,,1633615,,,,,,,,,,,,Aircraft Equipment Problem Less Severe; Deviation / Discrepancy - Procedural Published Material / Policy; Inflight Event / Encounter CFTT / CFIT; Inflight Event / Encounter Unstabilized Approach,,,Person Flight Crew,Other On Approach,Flight Crew Became Reoriented; Flight Crew FLC complied w / Automation / Advisory,Aircraft; Human Factors,Aircraft,"On the ILS for 28R in ZZZ; as we intercepted the localizer and were establishing on the glideslope soon after; we had FGC (Flight Guidance Computer) 1 FAIL; FGC 2 FAIL; Yaw Damp disconnect; Electric Trim Disconnect; Autopilot Disconnect; Auto Throttle Disconnect. All this while we were descending caused us to shoot below the glideslope and apparently trigger a ground proximity warning at Approach. We immediately corrected and climbed as ATC told us to; we were in VMC and had all terrain in sight. No GPWS (Ground Proximity Warning System) alerts occurred. We did not do much troubleshooting as we had the field in sight and were on approach; quick glance to see if the any circuit breakers were popped. Upon landing; we were told [Approach] wanted to have us call them; I did immediately after clearing customs and deplaning passengers. I told them we had equipment issues as we were intercepting; they took notes and I advised I'd file an [ASRS Report]. I also called both the Chief Pilot and Director of Safety to let them know what happened. Maintenance was informed of the write-up and MEL.We could have arrested the descent to make sure everything was ok; the momentary confusion of what exactly was happening probably caused us to dip too low. I'm not sure what else we could have done in the situation; we did not declare an emergency or get into detail with ATC of what was going on as we were on the approach and our attention was needed elsewhere. Maybe a quick declaration of the emergency would have helped?",,,,"G-IV Captain reported having multiple equipment issues on approach causing the aircraft to veer below the glideslope resulting in a terrain warning from ATC.",
